site_no,station_nm,dec_lat_va,dec_long_va,huc_cd,flow,flow_dt,flow_unit,flow_nday,class,percentile,percent_median,percent_mean
05535500,"WF OF NB CHICAGO RIVER AT NORTHBROOK IL",42.1383,-87.8347,07120003,46.03,2019-02-28,cfs,7,6,88.05,355.99,224.98
05536000,"NORTH BRANCH CHICAGO RIVER AT NILES, IL",42.0122,-87.7958,07120003,359.9,2019-02-28,cfs,7,6,88.23,401.18,232.31
05536085,"NB CHICAGO RIVER AT N PULASKI ROAD AT CH",41.9747,-87.7283,07120003,350.94,2019-02-28,cfs,7,0,0,0,0
05536162,"PLUM CREEK NEAR CRETE, IL",41.4356,-87.5714,07120003,45.61,2019-02-28,cfs,7,0,72.3,283.12,167.44
05536179,"HART DITCH AT DYER, IN",41.5078,-87.51,07120003,84.16,2019-02-28,cfs,7,0,74.44,224.43,126.59
05536190,"HART DITCH AT MUNSTER, IN",41.5611,-87.4806,07120003,142.43,2019-02-28,cfs,7,6,75.64,179.32,111.33
05536195,"LITTLE CALUMET RIVER AT MUNSTER, IN",41.5775,-87.5222,07120003,72.56,2019-02-28,cfs,7,5,53.8,115.69,70.88
05536215,"THORN CREEK AT GLENWOOD, IL",41.5303,-87.6223,07120003,81.76,2019-02-28,cfs,7,6,82.28,193.1,153.51
05536235,"DEER CREEK NEAR CHICAGO HEIGHTS, IL",41.5209,-87.5903,07120003,79.2,2019-02-28,cfs,7,6,86.64,372.01,221.41
05536255,"BUTTERFIELD CREEK AT FLOSSMOOR, IL",41.54,-87.6492,07120003,51.9,2019-02-28,cfs,7,6,78.8,297.08,167.1
05536265,"LANSING DITCH NEAR LANSING, IL",41.5284,-87.5292,07120003,21.81,2019-02-28,cfs,7,6,80.6,291.19,173.51
05536275,"THORN CREEK AT THORNTON, IL",41.5684,-87.6078,07120003,336.33,2019-02-28,cfs,6,6,84.4,314.5,202.3
05536290,"LITTLE CALUMET RIVER AT SOUTH HOLLAND, I",41.607,-87.5978,07120003,406.86,2019-02-28,cfs,7,6,80.26,216.41,137.92
05536340,"MIDLOTHIAN CREEK AT OAK FOREST, IL",41.6142,-87.7295,07120003,44.3,2019-02-28,cfs,7,6,84.98,402.73,207.79
05536343,"NATALIE CREEK AT MIDLOTHIAN, IL",41.6217,-87.7333,07120003,3.88,2019-02-28,cfs,7,0,67.12,524.32,181.31
05536357,"GRAND CALUMET RIVER AT HOHMAN AV AT HAMM",41.6245,-87.5181,07120003,,,,,0,,,
05536500,"TINLEY CREEK NEAR PALOS PARK, IL",41.6467,-87.7664,07120003,39.23,2019-02-28,cfs,7,6,82.95,414.69,192.87
05536580,"STONY CREEK (WEST) NEAR WORTH, IL",41.6892,-87.83,07120003,31.36,2019-02-28,cfs,7,0,0,0,0
05536890,"CHICAGO SANITARY AND SHIP CANAL NR LEMON",41.6914,-87.9644,07120004,3314.29,2019-02-28,cfs,7,0,74.46,147.4,127.99
05537500,"LONG RUN NEAR LEMONT, IL",41.6425,-87.9992,07120004,44.77,2019-02-28,cfs,7,5,73.17,237.63,137.08
05537980,"DES PLAINES RIVER AT ROUTE 53 AT JOLIET,",41.5364,-88.0825,07120004,6428.57,2019-02-28,cfs,7,0,86.14,185.57,174.13
05538360,"MARLEY CREEK AT MARLEY, IL",41.5394,-87.9308,07120004,60.27,2019-02-28,cfs,7,0,0,0,0
05539000,"HICKORY CREEK AT JOLIET, IL",41.515,-88.0734,07120004,338.4,2019-02-28,cfs,5,6,85.83,382.68,218.32
05539900,"WEST BRANCH DU PAGE RIVER NEAR WEST CHIC",41.9109,-88.179,07120004,112.8,2019-02-28,cfs,7,7,91.38,296.84,221.79
05540060,"KRESS CREEK AT WEST CHICAGO, IL",41.8564,-88.2039,07120004,65.07,2019-02-28,cfs,7,7,91.03,469.82,283.53
05540095,"WEST BRANCH DU PAGE RIVER NEAR WARRENVIL",41.8175,-88.1714,07120004,314.43,2019-02-28,cfs,7,6,89.6,295.05,194.93
05540130,"WEST BRANCH DU PAGE RIVER NEAR NAPERVILL",41.7206,-88.1319,07120004,408.43,2019-02-28,cfs,7,0,88.07,301.22,186.8
05540160,"EAST BRANCH DU PAGE RIVER NEAR DOWNERS G",41.8317,-88.0478,07120004,107.54,2019-02-28,cfs,7,0,88.46,220.55,165.34
05540195,"ST. JOSEPH CREEK AT ROUTE 34 AT LISLE, I",41.8019,-88.0689,07120004,11.92,2019-02-28,cfs,7,0,70.18,177.65,92.4
05540250,"EAST BRANCH DU PAGE RIVER AT BOLINGBROOK",41.7181,-88.0706,07120004,314.43,2019-02-28,cfs,7,0,91.13,306.04,214.22
05540275,"SPRING BROOK AT 87TH STREET NEAR NAPERVI",41.7258,-88.1636,07120004,40.06,2019-02-28,cfs,7,6,86.31,375.45,244.42
05540290,"DU PAGE RIVER NEAR PLAINFIELD, IL",41.69,-88.1664,07120004,777.57,2019-02-28,cfs,7,0,87.5,293.27,221.05
05540500,"DU PAGE RIVER AT SHOREWOOD, IL",41.5223,-88.1926,07120004,731.2,2019-02-28,cfs,5,6,81.6,220.53,156.76
05541710,"AUX SABLE CREEK NEAR MORRIS, IL",41.4173,-88.3476,07120005,518,2019-02-28,cfs,7,0,69.7,464.03,181.96
05542000,"MAZON RIVER NEAR COAL CITY, IL",41.2861,-88.3598,07120005,1370.29,2019-02-28,cfs,7,6,89.06,519.05,258.53
05543500,"ILLINOIS RIVER AT MARSEILLES, IL",41.327,-88.7176,07120005,18471.4,2019-02-28,cfs,7,6,79.94,160.78,132.66
05543830,"FOX RIVER AT WAUKESHA, WI",43.0047,-88.2436,07120006,,,,,0,,,
05544200,"MUKWONAGO RIVER AT MUKWONAGO, WI",42.8567,-88.3278,07120006,101.97,2019-02-28,cfs,7,6,86.31,172.57,158.34
05545750,"FOX RIVER NEAR NEW MUNSTER, WI",42.6109,-88.2259,07120006,1851.43,2019-02-28,cfs,7,0,88.6,241.41,213.33
05548105,"NIPPERSINK CREEK ABOVE WONDER LAKE, IL",42.3853,-88.3695,07120006,194.37,2019-02-28,cfs,7,0,84.27,299.03,196.04
05548280,"NIPPERSINK CREEK NEAR SPRING GROVE, IL",42.4433,-88.2475,07120006,417,2019-02-28,cfs,7,6,85.78,271.03,204.88
05549000,"BOONE CREEK NEAR MC HENRY, IL",42.3206,-88.3128,07120006,36.96,2019-02-28,cfs,7,6,89.56,291.71,217.8
05550001,"FOX RIVER (TAILWATER) AT ALGONQUIN, IL",42.1619,-88.2939,07120006,2347.14,2019-02-28,cfs,7,0,85.26,191.16,178.62
05550300,"TYLER CREEK AT ELGIN, IL",42.0583,-88.3039,07120006,103.89,2019-02-28,cfs,7,0,88.21,312.08,230.71
05550500,"POPLAR CREEK AT ELGIN, IL",42.0261,-88.2556,07120006,129.81,2019-02-28,cfs,7,7,93.24,505.1,292.36
05551000,"FOX RIVER AT SOUTH ELGIN, IL",41.9961,-88.295,07120007,2881.43,2019-02-28,cfs,7,0,83.39,214.35,169.03
05551200,"FERSON CREEK NEAR ST. CHARLES, IL",41.9328,-88.3408,07120007,167.42,2019-02-28,cfs,6,7,93.28,411.05,272.27
05551330,"MILL CREEK NEAR BATAVIA, IL",41.8458,-88.3492,07120007,86.53,2019-02-28,cfs,7,0,94.68,378.03,307.61
05551540,"FOX RIVER AT MONTGOMERY, IL",41.7336,-88.3333,07120007,3005,2019-02-28,cfs,4,0,81.69,206.23,167.56
05551545,"WAUBONSEE CREEK NEAR OSWEGO, IL",41.7014,-88.3272,07120007,53.63,2019-02-28,cfs,7,0,83.24,556.33,275.03
05551580,"FOX RIVER AT YORKVILLE, IL",41.6428,-88.4433,07120007,,,,,0,,,
05551675,"BLACKBERRY CREEK NEAR MONTGOMERY, IL",41.7408,-88.3833,07120007,169.16,2019-02-28,cfs,7,0,88.08,354.04,234.98
05551700,"BLACKBERRY CREEK NEAR YORKVILLE, IL",41.6717,-88.4414,07120007,191.23,2019-02-28,cfs,7,6,89.86,348.58,231.23
05552500,"FOX RIVER AT DAYTON, IL",41.3845,-88.7892,07120007,5724.29,2019-02-28,cfs,7,7,92.52,269.65,217.13
05554300,"INDIAN CREEK NEAR FAIRBURY, IL",40.7228,-88.53,07130002,138.49,2019-02-28,cfs,7,0,73.32,463.64,114.35
05554500,"VERMILION RIVER AT PONTIAC, IL",40.8778,-88.6362,07130002,1204.57,2019-02-28,cfs,7,6,82.84,348.72,176.8
05555300,"VERMILION RIVER NEAR LEONORE, IL",41.2084,-88.9309,07130002,3505.71,2019-02-28,cfs,7,6,81.19,424.49,204.02
05556500,"BIG BUREAU CREEK AT PRINCETON, IL",41.3672,-89.4978,07130001,659.43,2019-02-28,cfs,7,7,91.23,558.84,280.6
05558300,"ILLINOIS RIVER AT HENRY, IL",41.1072,-89.3561,07130001,30814.3,2019-02-28,cfs,7,6,80.72,202.54,147.61
05560500,"FARM CREEK AT FARMDALE, IL",40.6675,-89.5043,07130001,102.11,2019-02-28,cfs,7,7,92.81,595.74,330.45
05561500,"FONDULAC CREEK NEAR EAST PEORIA, IL",40.6773,-89.5312,07130001,5.97,2019-02-28,cfs,7,5,64.21,205.86,94.31
05567500,"MACKINAW RIVER NEAR CONGERVILLE, IL",40.6236,-89.2418,07130004,1935.86,2019-02-28,cfs,7,6,86.51,441.68,230.14
05568000,"MACKINAW RIVER NEAR GREEN VALLEY, IL",40.4542,-89.6062,07130004,2670,2019-02-28,cfs,7,6,86.38,311.4,219.46
05568500,"ILLINOIS RIVER AT KINGSTON MINES, IL",40.5531,-89.7773,07130003,37085.7,2019-02-28,cfs,7,6,87.55,197.41,178.78
05568800,"INDIAN CREEK NEAR WYOMING, IL",41.0189,-89.8356,07130005,279.91,2019-02-28,cfs,7,7,93.45,629.29,379.28
05569500,"SPOON RIVER AT LONDON MILLS, IL",40.7078,-90.28,07130005,3545.71,2019-02-28,cfs,7,7,91.72,480.08,276.9
05570000,"SPOON RIVER AT SEVILLE, IL",40.49,-90.3404,07130005,4904.29,2019-02-28,cfs,7,7,91.36,456.21,261.28
05570910,"SANGAMON RIVER AT FISHER, IL",40.3106,-88.3223,07130006,460,2019-02-28,cfs,7,6,76.85,293.8,124.12
05572000,"SANGAMON RIVER AT MONTICELLO, IL",40.0309,-88.589,07130006,938.43,2019-02-28,cfs,7,6,76.15,239.18,128.48
05573540,"SANGAMON RIVER AT ROUTE 48 AT DECATUR, I",39.8311,-88.9765,07130006,1342.14,2019-02-28,cfs,7,5,70.57,209.57,106.91
05576000,"SOUTH FORK SANGAMON RIVER NEAR ROCHESTER",39.7423,-89.5673,07130007,1410,2019-02-28,cfs,7,5,73.57,350,132.22
05576250,"SUGAR CREEK NEAR SPRINGFIELD, IL",39.7792,-89.5928,07130007,408.71,2019-02-28,cfs,7,0,66.83,1260.28,120.41
05576500,"SANGAMON RIVER AT RIVERTON, IL",39.8431,-89.5473,07130008,3430,2019-02-28,cfs,7,5,69.76,192.54,118.32
05577500,"SPRING CREEK AT SPRINGFIELD, IL",39.8153,-89.6987,07130008,147.37,2019-02-28,cfs,6,6,79.6,326.55,147.86
05578000,"SANGAMON RIVER AT PETERSBURG, IL",40.0133,-89.8383,07130008,3952.86,2019-02-28,cfs,7,0,63.05,284.38,95.91
05578100,"SALT CREEK NEAR FARMER CITY, IL",40.2278,-88.6606,07130009,198,2019-02-28,cfs,7,0,0,0,0
05578250,"NORTH FORK SALT CREEK NEAR DE WITT, IL",40.2353,-88.8097,07130009,244.14,2019-02-28,cfs,7,0,0,0,0
05578500,"SALT CREEK NEAR ROWELL, IL",40.115,-89.0492,07130009,513.14,2019-02-28,cfs,7,5,69.28,175.47,105.02
05579500,"LAKE FORK NEAR CORNLAND, IL",39.9517,-89.3856,07130009,361.86,2019-02-28,cfs,7,5,73.66,314.28,133.14
05579725,"LITTLE KICKAPOO CREEK NEAR HEYWORTH, IL",40.365,-88.9639,07130009,69.43,2019-02-28,cfs,7,0,81.45,232.99,162.41
05580000,"KICKAPOO CREEK AT WAYNESVILLE, IL",40.2548,-89.1292,07130009,436.57,2019-02-28,cfs,7,6,80.02,302.12,158.55
05580950,"SUGAR CREEK NEAR BLOOMINGTON, IL",40.4719,-89.0281,07130009,87.27,2019-02-28,cfs,7,5,74.29,193.33,117.57
05582000,"SALT CREEK NEAR GREENVIEW, IL",40.132,-89.7357,07130009,3071.43,2019-02-28,cfs,7,6,79.92,261.24,148.78
05583000,"SANGAMON RIVER NEAR OAKFORD, IL",40.1242,-89.985,07130008,7504.29,2019-02-28,cfs,7,6,75.37,235.35,145.84
05584500,"LA MOINE RIVER AT COLMAR, IL",40.3303,-90.8962,07130010,1703.4,2019-02-28,cfs,5,7,90.02,512.86,250.94
05585000,"LA MOINE RIVER AT RIPLEY, IL",40.0248,-90.6318,07130010,3197.14,2019-02-28,cfs,7,6,85.27,476.22,222.44
05586100,"ILLINOIS RIVER AT VALLEY CITY, IL",39.7034,-90.6454,07130011,56214.3,2019-02-28,cfs,7,7,91.04,207.32,192.28
05586647,"MACOUPIN CREEK AT HWY 108 NR CARLINVILLE",39.2767,-89.8361,07130012,122.01,2019-02-28,cfs,7,0,0,0,0
05586745,"MACOUPIN CREEK AT HWY 111 NR SUMMERVILLE",39.2044,-90.1006,07130012,360,2019-02-28,cfs,7,0,0,0,0
05587000,"MACOUPIN CREEK NEAR KANE, IL",39.2342,-90.3946,07130012,642.71,2019-02-28,cfs,7,6,75.06,225.74,65.02
05587450,"Mississippi River at Grafton, IL",38.968,-90.429,07110009,189429,2019-02-28,cfs,7,7,90.55,178.23,166.56
05587455,"MISSISSIPPI RIVER BELOW GRAFTON, IL",38.9512,-90.3712,07110009,189429,2019-02-28,cfs,7,0,89.47,158.61,168.82
05587900,"CAHOKIA CREEK AT EDWARDSVILLE, IL",38.8245,-89.9748,07140101,243.09,2019-02-28,cfs,7,5,71.79,266.4,74.37
05588000,"INDIAN CREEK AT WANDA, IL",38.8417,-90.0332,07140101,,,,,0,,,
05590050,"COPPER SLOUGH AT CHAMPAIGN, IL",40.0973,-88.3067,07140201,11.97,2019-02-28,cfs,7,0,61.23,142.67,88.67
05590520,"KASKASKIA RIVER BELOW FICKLIN, IL",39.7917,-88.3678,07140201,241.29,2019-02-28,cfs,7,0,62.23,350.76,134.84
05590800,"LAKE FORK AT ATWOOD, IL",39.8064,-88.4762,07140201,248.83,2019-02-28,cfs,6,5,66.58,154.56,84.52
05590950,"KASKASKIA RIVER AT CHESTERVILLE, IL",39.7031,-88.3864,07140201,540.57,2019-02-28,cfs,7,0,65.45,179.72,89.71
05591200,"KASKASKIA RIVER AT COOKS MILLS, IL",39.5834,-88.4134,07140201,702.71,2019-02-28,cfs,7,5,62.46,161.81,76.23
05591550,"WHITLEY CREEK NEAR ALLENVILLE, IL",39.5067,-88.5276,07140201,53.49,2019-02-28,cfs,7,5,72.82,173.33,96.08
05591700,"WEST OKAW RIVER NEAR LOVINGTON, IL",39.7311,-88.6626,07140201,165.86,2019-02-28,cfs,7,5,71.12,171.86,81.2
05592000,"KASKASKIA RIVER AT SHELBYVILLE, IL",39.4073,-88.7815,07140201,1480,2019-02-28,cfs,7,5,49.18,95.88,84.41
05592050,"ROBINSON CREEK NEAR SHELBYVILLE, IL",39.4059,-88.8965,07140201,101.96,2019-02-28,cfs,7,5,70.84,166.06,61.73
05592100,"KASKASKIA RIVER NEAR COWDEN, IL",39.2298,-88.8417,07140201,1971.43,2019-02-28,cfs,7,5,49.59,98.29,86.76
05592500,"KASKASKIA RIVER AT VANDALIA, IL",38.9606,-89.089,07140202,2570,2019-02-28,cfs,7,5,49.3,96.85,76.98
05592575,"HICKORY CREEK NEAR BROWNSTOWN, IL",38.937,-88.9528,07140202,32.3,2019-02-28,cfs,7,0,49.91,99.66,45.56
05592800,"HURRICANE CREEK NEAR MULBERRY GROVE, IL",38.9225,-89.2367,07140202,152.13,2019-02-28,cfs,7,5,65.1,220.93,47.02
05592900,"EAST FORK KASKASKIA RIVER NEAR SANDOVAL,",38.6889,-89.1001,07140202,125.66,2019-02-28,cfs,7,5,62.55,246.97,65.48
05593000,"KASKASKIA RIVER AT CARLYLE, IL",38.6117,-89.3562,07140202,4944.29,2019-02-28,cfs,7,5,57.65,123.3,111.77
05593575,"LITTLE CROOKED CREEK NEAR NEW MINDEN, IL",38.4417,-89.4167,07140202,62.94,2019-02-28,cfs,7,5,56.77,192.48,43.48
05593900,"EAST FORK SHOAL CREEK NEAR COFFEEN, IL",39.1486,-89.3525,07140203,55.16,2019-02-28,cfs,7,5,72.62,234.03,65.08
05593945,"SHOAL CREEK NEAR PIERRON, IL",38.7759,-89.499,07140203,684.43,2019-02-28,cfs,7,0,53.45,135.07,67.46
05594000,"SHOAL CREEK NEAR BREESE, IL",38.61,-89.4947,07140203,896,2019-02-28,cfs,7,5,70.87,219,82.07
05594100,"KASKASKIA RIVER NEAR VENEDY STATION, IL",38.4506,-89.6276,07140204,7584.29,2019-02-28,cfs,7,5,59.89,127.41,105.13
05594450,"SILVER CREEK NEAR TROY, IL",38.7167,-89.8293,07140204,207.14,2019-02-28,cfs,7,5,73.85,362.51,76.91
05594800,"SILVER CREEK NEAR FREEBURG, IL",38.4062,-89.874,07140204,858.86,2019-02-28,cfs,7,6,77.52,373.19,114.97
05595000,"KASKASKIA RIVER AT NEW ATHENS, IL",38.3197,-89.8886,07140204,9218.57,2019-02-28,cfs,7,0,55.2,108.36,131.26
05595200,"RICHLAND CREEK NEAR HECKER, IL",38.3239,-89.9706,07140204,271.71,2019-02-28,cfs,7,6,79.22,412.87,141.94
05595730,"RAYSE CREEK NEAR WALTONVILLE, IL",38.2539,-89.0406,07140106,71.81,2019-02-28,cfs,7,5,56.94,167.04,43.82
05595820,"CASEY FORK AT MOUNT VERNON, IL",38.2864,-88.8714,07140106,60.21,2019-02-28,cfs,7,5,51.17,103.65,51.06
05597000,"BIG MUDDY RIVER AT PLUMFIELD, IL",37.8914,-89.0194,07140106,2252.86,2019-02-28,cfs,7,6,83.26,232.56,187.41
05597500,"CRAB ORCHARD CREEK NEAR MARION, IL",37.7312,-88.8892,07140106,33.93,2019-02-28,cfs,7,5,58.58,133.06,59.42
05599490,"BIG MUDDY RIVER AT RTE 127 AT MURPHYSBOR",37.7583,-89.3278,07140106,6665.71,2019-02-28,cfs,7,6,86.44,253.31,197.93
06006000,"Red Rock Cr ab Lakes nr Lakeview MT",44.617,-111.657,10020001,,,,,0,,,
06012500,"Red Rock R bl Lima Reservoir nr Monida M",44.6559,-112.371,10020001,,,,,0,,,
06016000,"Beaverhead River at Barretts MT",45.1161,-112.75,10020002,,,,,0,,,
06017000,"Beaverhead River at Dillon MT",45.2184,-112.655,10020002,,,,,0,,,
06018500,"Beaverhead River near Twin Bridges MT",45.3834,-112.453,10020002,304.86,2019-02-28,cfs,7,5,26.12,73.01,75.07
06019500,"Ruby River above reservoir near Alder, M",45.1923,-112.143,10020003,,,,,0,,,
06020600,"Ruby River below reservoir near Alder, M",45.2419,-112.111,10020003,64.74,2019-02-28,cfs,7,6,86.01,162.3,149.79
06023000,"Ruby River near Twin Bridges MT",45.5069,-112.331,10020003,,,,,0,,,
06023500,"Big Hole River near Jackson MT",45.2458,-113.457,10020004,,,,,0,,,
06023800,"Big Hole River ab Spring Creek nr Jackso",45.361,-113.441,10020004,,,,,0,,,
06024020,"Big Hole River at Miner Creek nr Jackson",45.4229,-113.449,10020004,,,,,0,,,
06024450,"Big Hole River bl Big Lake Cr at Wisdom ",45.618,-113.457,10020004,,,,,0,,,
06024540,"Big Hole River bl Mudd Cr nr Wisdom MT",45.8075,-113.313,10020004,,,,,0,,,
06025250,"Big Hole River at Maiden Rock nr Divide ",45.7013,-112.736,10020004,,,,,0,,,
06025500,"Big Hole River near Melrose MT",45.5266,-112.702,10020004,,,,,0,,,
06026210,"Big Hole River near Glen MT",45.4401,-112.556,10020004,,,,,0,,,
06026500,"Jefferson River near Twin Bridges MT",45.6133,-112.329,10020005,,,,,0,,,
06033000,"Boulder River near Boulder MT",46.211,-112.092,10020006,48.31,2019-02-28,cfs,7,7,93.37,153.37,148.46
06035000,"Willow Creek near Harrison MT",45.7231,-111.741,10020005,,,,,0,,,
06036650,"Jefferson River near Three Forks MT",45.8971,-111.596,10020005,,,,,0,,,
06036805,"Firehole River at Old Faithful, YNP",44.4593,-110.822,10020007,47.47,2019-02-28,cfs,7,0,91.67,117.24,120.82
06036905,"Firehole River near West Yellowstone MT",44.6202,-110.864,10020007,285,2019-02-28,cfs,7,0,84.4,113.19,110
06036940,"Tantalus Creek at Norris Junction, YNP",44.7327,-110.713,10020007,5.43,2019-02-28,cfs,7,0,92.86,117.03,122.57
06037100,"Gibbon River at Madison Jct, YNP",44.6408,-110.861,10020007,94.02,2019-02-28,cfs,6,0,92.11,112.37,109.34
06037500,"Madison River near West Yellowstone, MT",44.6571,-111.068,10020007,455.43,2019-02-28,cfs,7,6,86.23,116.86,114.96
06038500,"Madison River bl Hebgen Lake nr Grayling",44.8664,-111.339,10020007,917.43,2019-02-28,cfs,7,6,76.91,114.15,110.43
06038800,"Madison River at Kirby Ranch nr Cameron ",44.8887,-111.581,10020007,989,2019-02-28,cfs,7,0,61.93,105.76,100.34
06040000,"Madison River near Cameron MT",45.2331,-111.752,10020007,1024,2019-02-28,cfs,7,0,63.85,104.19,104.42
06040800,"Madison River ab powerplant nr McAlliste",45.4866,-111.634,10020007,,,,,0,,,
06041000,"Madison River bl Ennis Lake nr McAlliste",45.4902,-111.635,10020007,1218.57,2019-02-28,cfs,7,4,24.07,86.07,87.99
06043500,"Gallatin River near Gallatin Gateway, MT",45.4973,-111.271,10020008,309.71,2019-02-28,cfs,7,5,62.06,108.18,103.86
06048650,"E Gallatin R ab Water Reclamation Fa nr ",45.7257,-111.066,10020008,,,,,0,,,
06050000,"Hyalite C at Hyalite R S nr Bozeman MT",45.5615,-111.071,10020008,,,,,0,,,
06052500,"Gallatin River at Logan MT",45.8854,-111.438,10020008,,,,,0,,,
06054500,"Missouri River at Toston MT",46.1466,-111.42,10030101,3110,2019-02-28,cfs,7,4,20.61,84.91,83.68
06061500,"Prickly Pear Creek near Clancy MT",46.5191,-111.947,10030101,,,,,0,,,
06062500,"Tenmile Creek near Rimini MT",46.5239,-112.257,10030101,1.08,2019-02-28,cfs,7,5,54.29,105.88,76.6
06063000,"Tenmile Creek near Helena MT",46.6049,-112.089,10030101,,,,,0,,,
06065500,"Missouri River bl Hauser Dam near Helena",46.7662,-111.889,10030101,4781.43,2019-02-28,cfs,7,6,78.36,133.61,122
06066500,"Missouri River bl Holter Dam nr Wolf Cr ",46.9947,-112.011,10030101,4957.14,2019-02-28,cfs,7,5,59.64,108.98,102.76
06071300,"Little Prickly Pear Cr at Wolf Cr MT",47.0054,-112.07,10030101,,,,,0,,,
06073500,"Dearborn River near Craig MT",47.199,-112.096,10030102,,,,,0,,,
06074000,"Missouri River at Cascade MT",47.2695,-111.695,10030102,,,,,0,,,
06076690,"Smith River near Ft Logan MT",46.7958,-111.179,10030103,,,,,0,,,
06077200,"Smith River bl Eagle Cr nr Fort Logan MT",46.828,-111.192,10030103,,,,,0,,,
06077500,"Smith River near Eden MT",47.1901,-111.387,10030103,,,,,0,,,
06078200,"Missouri River near Ulm MT",47.435,-111.388,10030102,,,,,0,,,
06078500,"North Fork Sun River near Augusta MT",47.6399,-112.859,10030104,,,,,0,,,
06079000,"South Fork Sun River near Augusta MT",47.6286,-112.866,10030104,,,,,0,,,
06080900,"Sun River bl Diversion Dam nr Augusta MT",47.6185,-112.692,10030104,,,,,0,,,
06082200,"Sun River bl Willow Cr nr Augusta MT",47.5471,-112.367,10030104,,,,,0,,,
06085800,"Sun River at Simms MT",47.5016,-111.932,10030104,,,,,0,,,
06088500,"Muddy Creek at Vaughn MT",47.5613,-111.542,10030104,,,,,0,,,
06089000,"Sun River near Vaughn MT",47.5258,-111.511,10030104,,,,,0,,,
06090300,"Missouri River near Great Falls MT",47.5844,-111.061,10030102,5522.86,2019-02-28,cfs,7,5,35.2,93.02,89.08
06090500,"Belt Creek near Monarch MT",47.2086,-110.932,10030105,,,,,0,,,
06090800,"Missouri River at Fort Benton MT",47.8169,-110.666,10030102,,,,,0,,,
06091700,"Two Medicine River bl South Fork nr Brow",48.427,-112.99,10030201,,,,,0,,,
06093200,"Badger Cr bl Four Horns Canal nr Brownin",48.3694,-112.802,10030201,,,,,0,,,
06099000,"Cut Bank Creek at Cut Bank MT",48.6334,-112.346,10030202,,,,,0,,,
06099500,"Marias River near Shelby MT",48.4272,-111.89,10030203,,,,,0,,,
06101500,"Marias River near Chester MT",48.306,-111.081,10030203,581,2019-02-28,cfs,7,5,73.04,117.51,119.12
06102050,"Marias River near Loma MT",47.9459,-110.581,10030203,,,,,0,,,
06102500,"Teton River bl South Fork nr Choteau MT",47.8831,-112.612,10030205,,,,,0,,,
06108000,"Teton River near Dutton MT",47.9303,-111.553,10030205,,,,,0,,,
06108800,"Teton River at Loma MT",47.9327,-110.514,10030203,,,,,0,,,
06109500,"Missouri River at Virgelle MT",48.0038,-110.259,10040101,,,,,0,,,
06110020,"Judith River above Carr Creek near Utica",46.9177,-110.189,10040103,,,,,0,,,
06111800,"Big Spring Cr at R&B Trading Post nr Lew",47.0878,-109.457,10040103,150.14,2019-02-28,cfs,7,0,25,88.54,85.61
06114700,"Judith River nr mouth, nr Winifred MT",47.6684,-109.653,10040103,,,,,0,,,
06115200,"Missouri River near Landusky MT",47.6314,-108.688,10040104,,,,,0,,,
06118500,"South Fork Musselshell R ab Martinsdale ",46.4532,-110.382,10040201,,,,,0,,,
06119600,"Musselshell River nr Martinsdale, MT",46.477,-110.249,10040201,,,,,0,,,
06120500,"Musselshell River at Harlowton MT",46.4288,-109.841,10040201,,,,,0,,,
06123030,"Musselshell River ab Mud Cr nr Shawmut M",46.319,-109.461,10040201,,,,,0,,,
06125600,"Musselshell River ab Big Coulee Creek at",46.2891,-108.938,10040201,,,,,0,,,
06126500,"Musselshell River near Roundup MT",46.428,-108.573,10040201,,,,,0,,,
06130000,"Flatwillow Creek near Mosby MT",46.9287,-107.933,10040205,,,,,0,,,
06130500,"Musselshell River at Mosby MT",46.9947,-107.889,10040205,,,,,0,,,
06131200,"Nelson Creek near Van Norman MT",47.5366,-106.153,10040104,,,,,0,,,
06133500,"N F Milk River ab St. Mary canal nr Brow",48.9708,-113.056,10050001,91.14,2019-02-28,cfs,5,0,0,0,0
06135000,"Milk River at Eastern Crossing of Int Bn",48.9748,-110.422,10050002,,,,,0,,,
06139500,"Big Sandy Creek near Havre MT",48.5267,-109.842,10050005,,,,,0,,,
06140500,"Milk River at Havre MT",48.5637,-109.696,10050004,,,,,0,,,
06142400,"Clear Creek near Chinook MT",48.5789,-109.391,10050004,,,,,0,,,
06151500,"Battle Creek near Chinook MT",48.6495,-109.232,10050008,,,,,0,,,
06154100,"Milk River near Harlem MT",48.4896,-108.759,10050004,,,,,0,,,
06154400,"Peoples Creek near Hays MT",48.2237,-108.714,10050009,,,,,0,,,
06155030,"Milk River near Dodson MT",48.4028,-108.294,10050004,,,,,0,,,
06155500,"Milk River at Malta MT",48.3619,-107.863,10050004,,,,,0,,,
06164000,"Frenchman River at international boundar",49,-107.303,10050013,,,,,0,,,
06164510,"Milk River at Juneberg Bridge nr Saco MT",48.5092,-107.219,10050013,,,,,0,,,
06167500,"Beaver Creek near Hinsdale MT",48.4203,-107.171,10050014,,,,,0,,,
06169500,"Rock Creek bl Horse Creek nr int'l bound",48.9694,-106.84,10050015,,,,,0,,,
06174500,"Milk River at Nashua MT",48.1301,-106.364,10050012,,,,,0,,,
06177000,"Missouri River near Wolf Point MT",48.0673,-105.533,10060001,,,,,0,,,
06177500,"Redwater River at Circle MT",47.414,-105.576,10060002,,,,,0,,,
06178500,"East Poplar River at international bound",49,-105.41,10060003,,,,,0,,,
06181000,"Poplar River near Poplar MT",48.1179,-105.193,10060003,,,,,0,,,
06183450,"Big Muddy Creek near Antelope MT",48.6729,-104.512,10060006,,,,,0,,,
06185110,"Big Muddy Creek nr mouth nr Culbertson M",48.1645,-104.63,10060006,,,,,0,,,
06185500,"Missouri River near Culbertson MT",48.1235,-104.473,10060005,,,,,0,,,
06186500,"Yellowstone River at Yellowstone Lk Outl",44.5671,-110.38,10070001,,,,,0,,,
06187915,"Soda Butte Cr at Park Bndry at Silver Ga",45.0028,-110.002,10070001,,,,,0,,,
06188000,"Lamar River nr Tower Ranger Station YNP",44.9282,-110.394,10070001,,,,,0,,,
06190540,"Boiling River at Mammoth,YNP",44.9851,-110.689,10070001,22.23,2019-02-28,cfs,7,0,36.09,92.59,93.44
06191000,"Gardner River near Mammoth, YNP",44.9923,-110.691,10070001,94.18,2019-02-28,cfs,4,5,68.37,104.73,102.38
06191500,"Yellowstone River at Corwin Springs MT",45.1121,-110.794,10070002,748.57,2019-02-28,cfs,7,5,29.8,89.39,88.96
06192500,"Yellowstone River near Livingston, MT",45.5972,-110.566,10070002,963.29,2019-02-28,cfs,7,4,12.56,79.8,78.79
06192980,"Shields River abv Smith Cr, nr Wilsall, ",46.1666,-110.548,10070003,,,,,0,,,
06195600,"Shields River nr Livingston MT",45.7384,-110.479,10070003,,,,,0,,,
06200000,"Boulder River at Big Timber MT",45.8338,-109.939,10070002,,,,,0,,,
06204050,"West Rosebud Creek near Roscoe MT",45.2432,-109.731,10070005,51.49,2019-02-28,cfs,7,5,37.56,84.51,84.7
06204070,"W Rosebud Cr at Emerald Lk Campground nr",45.2544,-109.7,10070005,55.83,2019-02-28,cfs,7,0,8.33,65.42,66.14
06205000,"Stillwater River near Absarokee MT",45.5367,-109.422,10070005,,,,,0,,,
06207500,"Clarks Fork Yellowstone River nr Belfry ",45.0099,-109.065,10070006,,,,,0,,,
06208500,"Clarks Fork Yellowstone River at Edgar M",45.4657,-108.844,10070006,,,,,0,,,
06209500,"Rock Creek near Red Lodge MT",45.0861,-109.329,10070006,,,,,0,,,
06211000,"Red Lodge Cr ab Cooney Re nr Boyd MT",45.4379,-109.253,10070006,,,,,0,,,
06211500,"Willow Creek near Boyd MT",45.4221,-109.231,10070006,,,,,0,,,
06214500,"Yellowstone River at Billings MT",45.8001,-108.468,10070007,,,,,0,,,
06218500,"WIND RIVER NEAR DUBOIS, WY",43.5786,-109.76,10080001,,,,,0,,,
06220800,"WIND RIVER ABOVE RED CREEK, NEAR DUBOIS,",43.4416,-109.459,10080001,211.86,2019-02-28,cfs,7,0,80.97,125.58,116.69
06221400,"DINWOODY CREEK ABOVE LAKES, NEAR BURRIS,",43.3462,-109.409,10080001,6.93,2019-02-28,cfs,7,5,42.22,90.47,91.79
06224000,"BULL LAKE CREEK ABOVE BULL LAKE, WY",43.1766,-109.203,10080001,36.49,2019-02-28,cfs,7,7,91.04,164.3,147.43
06227600,"WIND RIVER NEAR KINNEAR, WY",43.1428,-108.709,10080001,,,,,0,,,
06228000,"WIND RIVER AT RIVERTON, WY",43.0105,-108.377,10080001,,,,,0,,,
06228350,"SF L WIND RIV AB WASHAKIE RES, NR FT WAS",42.9683,-109.038,10080002,,,,,0,,,
06235500,"LITTLE WIND RIVER NEAR RIVERTON, WY",42.9975,-108.375,10080002,,,,,0,,,
06253000,"FIVEMILE CREEK NEAR SHOSHONI, WY",43.2219,-108.22,10080005,,,,,0,,,
06274300,"BIGHORN RIVER AT BASIN, WY",44.3833,-108.036,10080007,,,,,0,,,
06278300,"SHELL CREEK ABOVE SHELL CREEK RESERVOIR,",44.508,-107.404,10080010,,,,,0,,,
06279500,"BIGHORN RIVER AT KANE, WY",44.7586,-108.181,10080010,,,,,0,,,
06279940,"NORTH FORK SHOSHONE RIVER AT WAPITI, WY",44.4697,-109.43,10080012,,,,,0,,,
06280300,"SOUTH FORK SHOSHONE RIVER NEAR VALLEY, W",44.2079,-109.555,10080013,73.49,2019-02-28,cfs,7,5,56.18,103.41,99.31
