site_no,station_nm,dec_lat_va,dec_long_va,huc_cd,flow,flow_dt,flow_unit,flow_nday,class,percentile,percent_median,percent_mean
09246500,"ELKHEAD CREEK NEAR CRAIG, CO",40.5311,-107.436,14050001,,,,,0,,,
09247600,"YAMPA RIVER BELOW CRAIG, CO.",40.4808,-107.614,14050001,,,,,0,,,
09251000,"YAMPA RIVER NEAR MAYBELL, CO",40.5027,-108.033,14050002,,,,,0,,,
09253000,"LITTLE SNAKE RIVER NEAR SLATER, CO",40.9994,-107.143,14050003,,,,,0,,,
09255000,"SLATER FORK NEAR SLATER, CO",40.9825,-107.383,14050003,,,,,0,,,
09257000,"LITTLE SNAKE RIVER NEAR DIXON, WY",41.0285,-107.549,14050003,,,,,0,,,
09258050,"Muddy Creek above Olson Draw, near Dad, ",41.4783,-107.603,14050004,,,,,0,,,
09258980,"MUDDY CREEK BELOW YOUNG DRAW, NEAR BAGGS",41.0682,-107.632,14050004,0.17,2019-02-28,cfs,7,0,7.14,2.79,0.94
09260000,"LITTLE SNAKE RIVER NEAR LILY, CO",40.549,-108.424,14050003,,,,,0,,,
09260050,"YAMPA RIVER AT DEERLODGE PARK, CO",40.4516,-108.525,14050002,,,,,0,,,
09261000,"GREEN RIVER NEAR JENSEN, UT",40.4094,-109.235,14060001,2597.14,2019-02-28,cfs,7,5,60.81,125.55,105.26
09261700,"BIG BRUSH CRK ABV RED FLEET RES, NR VERN",40.5888,-109.465,14060002,9.47,2019-02-28,cfs,5,2,3.99,71.26,69.38
09266500,"ASHLEY CREEK NEAR VERNAL, UT",40.5775,-109.622,14060002,,,,,0,,,
09272400,"GREEN RIVER AT OURAY, UTAH",40.0847,-109.677,14060003,,,,,0,,,
09277500,"DUCHESNE RIVER NEAR TABIONA, UT",40.3002,-110.602,14060003,61.27,2019-02-28,cfs,7,2,3.29,68.73,68.5
09279000,"ROCK CREEK NEAR MOUNTAIN HOME, UT",40.4933,-110.578,14060003,39.11,2019-02-28,cfs,7,5,60.98,102.89,90.45
09285900,"STRAWBERRY RIVER AT PINNACLES NEAR FRUIT",40.1272,-110.742,14060004,,,,,0,,,
09288000,"CURRANT CREEK NEAR FRUITLAND, UT",40.2002,-110.908,14060004,26.66,2019-02-28,cfs,7,4,21.16,87.9,84.15
09288180,"STRAWBERRY RIVER NEAR DUCHESNE, UT",40.1547,-110.555,14060004,,,,,0,,,
09289500,"LAKE FORK RIVER AB MOON LAKE, NR MOUNTAI",40.6066,-110.527,14060003,,,,,0,,,
09291000,"LAKE FORK RIVER BL MOON LAKE NR MOUNTAIN",40.5563,-110.485,14060003,3.86,2019-02-28,cfs,7,6,82.39,0,125.32
09292000,"YELLOWSTONE R @ BRIDGE CMPGRND NR ALTONA",40.5463,-110.334,14060003,,,,,0,,,
09292500,"YELLOWSTONE RIVER NEAR ALTONAH, UT",40.5119,-110.342,14060003,38.95,2019-02-28,cfs,4,4,11.07,82.63,81.95
09295000,"DUCHESNE RIVER AT MYTON, UT",40.2002,-110.064,14060003,,,,,0,,,
09295100,"DUCHESNE RIV ABV UINTA RIV, NR RANDLETT,",40.2066,-109.86,14060003,,,,,0,,,
09296800,"UINTA R BLW POWERPLANT DIVERSION, NR NEO",40.5913,-110.114,14060003,22.08,2019-02-28,cfs,4,0,19.37,73.77,71.85
09299500,"WHITEROCKS RIVER NEAR WHITEROCKS, UT",40.5936,-109.932,14060003,,,,,0,,,
09301500,"UINTA RIVER AT RANDLETT, UT",40.2336,-109.804,14060003,,,,,0,,,
09302000,"DUCHESNE RIVER NEAR RANDLETT, UT",40.2103,-109.781,14060003,,,,,0,,,
09304200,"WHITE RIVER ABOVE COAL CREEK NEAR MEEKER",40.005,-107.825,14050005,237.86,2019-02-28,cfs,7,3,7.83,84.09,82.3
09304500,"WHITE RIVER NEAR MEEKER, CO.",40.0336,-107.862,14050005,262.14,2019-02-28,cfs,7,4,12.78,85.81,84.69
09304800,"WHITE RIVER BELOW MEEKER, CO",40.0226,-108.12,14050005,,,,,0,,,
09306200,"PICEANCE CREEK BL RYAN GULCH, NR RIO BLA",39.9211,-108.298,14050006,,,,,0,,,
09306222,"PICEANCE CREEK AT WHITE RIVER, CO",40.078,-108.236,14050005,,,,,0,,,
09306242,"CORRAL GULCH NEAR RANGELY, CO",39.9202,-108.473,14050006,0.14,2019-02-28,cfs,7,3,7,27.45,21.54
09306255,"YELLOW CREEK NEAR WHITE RIVER, CO.",40.1686,-108.401,14050007,,,,,0,,,
09306290,"WHITE RIVER BELOW BOISE CREEK, NEAR RANG",40.1797,-108.565,14050007,,,,,0,,,
09306500,"WHITE RIVER NEAR WATSON, UTAH",39.9789,-109.179,14050007,,,,,0,,,
09310500,"FISH CREEK ABOVE RESERVOIR, NEAR SCOFIEL",39.7744,-111.191,14060007,,,,,0,,,
09310700,"MUD CRK BL WINTER QUARTERS CYN @ SCOFIEL",39.7216,-111.161,14060007,,,,,0,,,
09312600,"WHITE R BL TABBYUNE CRK NR SOLDIER SUMMI",39.8758,-111.037,14060007,,,,,0,,,
09314500,"PRICE RIVER AT WOODSIDE, UT",39.2644,-110.343,14060007,,,,,0,,,
09315000,"GREEN RIVER AT GREEN RIVER, UT",38.9861,-110.151,14060008,2945.71,2019-02-28,cfs,7,5,58.3,112.55,91.67
09319000,"EPHRAIM TUNNEL NEAR EPHRAIM, UT",39.3297,-111.432,14060009,,,,,0,,,
09326500,"FERRON CREEK (UPPER STATION) NEAR FERRON",39.1041,-111.217,14060009,,,,,0,,,
09328500,"SAN RAFAEL RIVER NEAR GREEN RIVER, UT",38.8583,-110.37,14060009,14.08,2019-02-28,cfs,4,1,1.22,22.35,17.53
09328910,"SAN RAFAEL RIVER AT MOUTH NEAR GREEN RIV",38.7578,-110.144,14060009,17.95,2019-02-28,cfs,4,0,33.33,47.65,47.65
09328920,"GREEN RIVER AT MINERAL BOTTOM NR CYNLNDS",38.524,-109.994,14060008,3045.71,2019-02-28,cfs,7,0,25,62.03,64.53
09329050,"SEVEN MILE CREEK NEAR FISH LAKE, UT",38.6278,-111.648,14070003,6.5,2019-02-28,cfs,7,5,53.61,102.04,99.24
09330000,"FREMONT RIVER NEAR BICKNELL, UT",38.3069,-111.519,14070003,63.6,2019-02-28,cfs,7,1,2.38,70.22,67.33
09330500,"MUDDY CREEK NEAR EMERY, UT",38.9911,-111.254,14070002,4.18,2019-02-28,cfs,4,3,6.25,48.95,45.88
09333500,"DIRTY DEVIL R AB POISON SP WSH NR HANKSV",38.0942,-110.407,14070004,105.86,2019-02-28,cfs,7,4,15.99,85.27,73.44
09337000,"PINE CREEK NEAR ESCALANTE, UT",37.8625,-111.636,14070005,,,,,0,,,
09337500,"ESCALANTE RIVER NEAR ESCALANTE, UT",37.778,-111.575,14070005,3.5,2019-02-28,cfs,7,4,21.13,42.27,34.15
09342500,"SAN JUAN RIVER AT PAGOSA SPRINGS, CO",37.2655,-107.011,14080101,45.44,2019-02-28,cfs,7,4,13.83,70.53,60.06
09346400,"SAN JUAN RIVER NEAR CARRACAS, CO.",37.0136,-107.312,14080101,100.78,2019-02-28,cfs,5,3,8.1,47.35,42
09349800,"PIEDRA RIVER NEAR ARBOLES, CO.",37.0883,-107.398,14080102,,,,,0,,,
09352800,"LOS PINOS R ABV VALLECITO RES NR BAYFIEL",37.4147,-107.513,14080101,,,,,0,,,
09352900,"VALLECITO CREEK NEAR BAYFIELD, CO.",37.4775,-107.544,14080101,,,,,0,,,
09353800,"LOS PINOS RIVER NEAR IGNACIO, CO",37.1661,-107.582,14080101,,,,,0,,,
09354500,"LOS PINOS RIVER AT LA BOCA, CO.",37.0094,-107.6,14080101,,,,,0,,,
09355500,"SAN JUAN RIVER NEAR ARCHULETA, NM",36.8019,-107.699,14080101,287.43,2019-02-28,cfs,7,3,8.56,53.85,32.79
09358000,"ANIMAS RIVER AT SILVERTON, CO.",37.8111,-107.659,14080104,,,,,0,,,
09358550,"CEMENT CREEK AT SILVERTON, CO",37.8197,-107.664,14080104,,,,,0,,,
09359010,"MINERAL CREEK AT SILVERTON, CO",37.8028,-107.673,14080104,,,,,0,,,
09359080,"CASCADE CR ABV CASCADE CR DIVERSION NR R",37.6673,-107.823,14080104,,,,,0,,,
09359082,"CASCADE CR BLW CASCADE CR DIVERSION NR R",37.667,-107.822,14080104,,,,,0,,,
09359500,"ANIMAS RIVER AT TALL TIMBER RESORT ABOVE",37.5974,-107.777,14080104,,,,,0,,,
09361500,"ANIMAS RIVER AT DURANGO, CO",37.2792,-107.88,14080104,169.43,2019-02-28,cfs,7,4,20.96,84.59,79.09
09362520,"ANIMAS RIVER BLW DURANGO PUMP PLANT NR D",37.2493,-107.873,14080104,222.43,2019-02-28,cfs,7,0,48.82,98.86,89.08
09363500,"ANIMAS RIVER NEAR CEDAR HILL, NM",37.0366,-107.875,14080104,,,,,0,,,
09364010,"ANIMAS RIVER BELOW AZTEC, NM",36.8184,-108.023,14080104,240.14,2019-02-28,cfs,7,0,43,92.92,80.51
09364500,"ANIMAS RIVER AT FARMINGTON, NM",36.7225,-108.202,14080104,239.14,2019-02-28,cfs,7,5,30.4,86.06,75.87
09365000,"SAN JUAN RIVER AT FARMINGTON, NM",36.723,-108.226,14080105,535.43,2019-02-28,cfs,7,4,11.64,61.8,46.54
09367000,"LA PLATA RIVER AT LA PLATA, NM",36.9309,-108.185,14080105,0.28,2019-02-28,cfs,7,0,8.49,3.65,2.66
09367500,"LA PLATA RIVER NEAR FARMINGTON, NM",36.7376,-108.25,14080105,2.98,2019-02-28,cfs,7,4,21.29,18.59,13.02
09367540,"SAN JUAN R NR FRUITLAND, NM",36.7403,-108.403,14080105,603.57,2019-02-28,cfs,7,0,0,0,0
09367580,"HOGBACK CANAL NEAR WATERFLOW, NM",36.7464,-108.538,14080105,,,,,0,,,
09368000,"SAN JUAN RIVER AT SHIPROCK, NM",36.7767,-108.683,14080105,598.29,2019-02-28,cfs,7,4,15.59,65.18,49.74
09371000,"MANCOS RIVER NEAR TOWAOC, CO.",37.0275,-108.741,14080107,,,,,0,,,
09371010,"SAN JUAN RIVER AT FOUR CORNERS, CO",37.0011,-109.03,14080201,605.29,2019-02-28,cfs,7,4,10.99,63.71,47.64
09371492,"MUD CREEK AT STATE HIGHWAY 32, NEAR CORT",37.3128,-108.661,14080202,,,,,0,,,
09371520,"MCELMO CREEK ABOVE TRAIL CANYON NEAR COR",37.3267,-108.701,14080202,,,,,0,,,
09372000,"MCELMO CREEK NEAR COLORADO-UTAH STATE LI",37.3242,-109.016,14080202,,,,,0,,,
09378170,"SOUTH CREEK ABOVE RESERVOIR NEAR MONTICE",37.8467,-109.37,14080203,0,2019-02-28,cfs,7,4,,,
09378630,"RECAPTURE CREEK NEAR BLANDING, UT",37.7556,-109.477,14080201,0,2019-02-28,cfs,7,0,,,
09379200,"CHINLE CREEK NEAR MEXICAN WATER, AZ",36.9439,-109.711,14080204,54.2,2019-02-28,cfs,7,6,88.84,874.19,264.91
09379500,"SAN JUAN RIVER NEAR BLUFF, UT",37.1507,-109.867,14080205,710.14,2019-02-28,cfs,7,4,22.77,67.33,51.09
09380000,"COLORADO RIVER AT LEES FERRY, AZ",36.8643,-111.588,14070007,14142.9,2019-02-28,cfs,7,6,86.58,147.84,140.53
09381800,"PARIA RIVER NEAR KANAB, UTAH",37.1075,-111.906,14070007,27.17,2019-02-28,cfs,7,0,54.74,112.93,95.77
09382000,"PARIA RIVER AT LEES FERRY, AZ",36.8722,-111.595,14070007,32.31,2019-02-28,cfs,7,5,66.95,130.33,85.75
09383300,"FILLER DITCH AT GREER, AZ",34.0162,-109.458,15020001,13,2019-02-28,cfs,7,0,96.3,276.6,306.6
09383400,"LITTLE COLORADO RIVER AT GREER, AZ",34.0167,-109.457,15020001,11.18,2019-02-28,cfs,7,6,82.26,200.72,162.97
09383409,"SOUTH FORK LITTLE COLORADO RIVER NEAR GR",34.0555,-109.401,15020001,,,,,0,,,
09384000,"LITTLE COLORADO R ABV LYMAN LAKE NR ST. ",34.3145,-109.362,15020001,7.84,2019-02-28,cfs,7,5,38.14,88.19,53.33
09385700,"LITTLE COLORADO RIVER BELOW SALADO SPRIN",34.4506,-109.362,15020002,1.18,2019-02-28,cfs,7,0,46.72,84.89,66.29
09386030,"LITTLE COLORADO RVR ABV ZION RES. NR ST.",34.5836,-109.407,15020002,0.1,2019-02-28,cfs,7,5,28.57,2.54,1.92
09386300,"LITTLE COLORADO RVR BLW ZION RES. NR ST ",34.6048,-109.489,15020002,,,,,0,,,
09386900,"RIO NUTRIA NEAR RAMAH, NM",35.2826,-108.553,15020004,2.42,2019-02-28,cfs,7,5,62.05,432.14,26.11
09386950,"ZUNI RIVER ABV BLACK ROCK RESERVOIR, NM",35.1003,-108.752,15020004,1.03,2019-02-28,cfs,7,5,36.88,83.06,11.1
09390500,"SHOW LOW CREEK NEAR LAKESIDE, AZ",34.1795,-109.988,15020005,8.67,2019-02-28,cfs,7,5,46.69,76.66,27.66
09394500,"LITTLE COLORADO RIVER AT WOODRUFF, AZ",34.7828,-110.044,15020002,38.47,2019-02-28,cfs,7,5,74.99,430.8,79.83
09396100,"PUERCO RIVER NEAR CHAMBERS, AZ",35.1822,-109.447,15020007,36.53,2019-02-28,cfs,7,0,66.67,1368.16,1368.16
09397000,"LITTLE COLORADO RIVER AT HOLBROOK, AZ",34.8978,-110.163,15020008,100.9,2019-02-28,cfs,7,6,86.18,934.26,207.1
09397300,"LITTLE COLORADO RIVER NEAR JOSEPH CITY, ",34.9011,-110.255,15020008,384.57,2019-02-28,cfs,7,0,75,0,4695.6
09397500,"CHEVELON FORK BELOW WILDCAT CANYON, NR W",34.6364,-110.714,15020010,12.03,2019-02-28,cfs,7,5,36.15,29.04,15.15
09399400,"JACKS CANYON CREEK NEAR WINSLOW, AZ",34.9214,-110.798,15020008,2.61,2019-02-28,cfs,7,0,80.49,0,34.71
09400350,"LITTLE COLORADO RIVER NEAR WINSLOW, AZ",35.0117,-110.651,15020008,47.5,2019-02-28,cfs,7,0,55.09,123.47,16.98
09400568,"POLACCA WASH NEAR SECOND MESA, AZ",35.6548,-110.563,15020013,1.64,2019-02-28,cfs,7,0,95.46,745.45,565.52
09400815,"NEWMAN CANYON ABOVE UPPER LAKE MARY, AZ",35.0549,-111.489,15020015,4.76,2019-02-28,cfs,7,0,25,23.26,26.34
09401110,"DINNEBITO WASH NEAR SAND SPRINGS, AZ",35.7807,-110.93,15020017,0.09,2019-02-28,cfs,7,0,4,22.5,12.33
09401260,"MOENKOPI WASH AT MOENKOPI, AZ",36.105,-111.202,15020018,11.73,2019-02-28,cfs,7,7,93.91,374.76,271.53
09401265,"PASTURE CANYON SPRINGS NEAR TUBA CITY, A",36.1716,-111.201,15020018,,,,,0,,,
09402000,"LITTLE COLORADO RIVER NEAR CAMERON, AZ",35.9264,-111.567,15020016,420.71,2019-02-28,cfs,7,6,77.35,1205.82,113.69
09402300,"LITTLE COLORADO RIVER ABV MOUTH NR DESER",36.1953,-111.777,15020016,777.43,2019-02-28,cfs,7,0,75.76,313.03,128.55
09402500,"COLORADO RIVER NEAR GRAND CANYON, AZ",36.1014,-112.086,15010001,14214.3,2019-02-28,cfs,7,6,80.88,142.2,131.55
09403600,"KANAB CREEK NEAR KANAB, UT",37.1005,-112.548,15010003,4.2,2019-02-28,cfs,7,1,2.56,35.87,26.1
09403850,"KANAB CREEK ABOVE THE MOUTH NEAR SUPAI, ",36.3958,-112.632,15010002,7.27,2019-02-28,cfs,7,0,58.32,178.19,43.07
09404104,"CATARACT CREEK AT REDLANDS CROSSING NEAR",35.8044,-112.426,15010004,0,2019-02-28,cfs,7,0,,,
09404107,"CATARACT CREEK BELOW HEATHER WASH NEAR S",36.04,-112.547,15010004,1.04,2019-02-28,cfs,7,0,0,0,0
09404110,"HAVASU CREEK AT SUPAI, AZ",36.2195,-112.69,15010004,60.47,2019-02-28,cfs,7,0,10.33,94.34,89.41
09404115,"HAVASU CREEK ABOVE THE MOUTH, NEAR SUPAI",36.3058,-112.761,15010004,86.84,2019-02-28,cfs,7,0,86.77,120.51,112.39
09404200,"COLORADO RVR ABV DIAMOND CREEK NR PEACH ",35.7736,-113.364,15010002,15600,2019-02-28,cfs,7,0,77.27,120.03,107.4
09404208,"DIAMOND CREEK NEAR PEACH SPRINGS, AZ",35.765,-113.368,15010002,4.23,2019-02-28,cfs,7,0,15.67,81.66,69.57
09404343,"TRUXTON WASH NEAR VALENTINE, AZ",35.3842,-113.658,15010007,0,2019-02-28,cfs,7,0,,,
09404450,"EAST FORK VIRGIN RIVER NEAR GLENDALE, UT",37.3394,-112.604,15010008,16.14,2019-02-28,cfs,7,4,24.08,82.47,79.47
09404900,"EAST FORK VIRGIN RIVER NEAR SPRINGDALE, ",37.1642,-112.959,15010008,62.66,2019-02-28,cfs,7,0,36.9,93.54,88.53
09405500,"NORTH FORK VIRGIN RIVER NEAR SPRINGDALE,",37.2097,-112.979,15010008,56.04,2019-02-28,cfs,7,0,15.59,82.58,72.97
09406000,"VIRGIN RIVER AT VIRGIN, UT",37.2042,-113.181,15010008,150.57,2019-02-28,cfs,7,5,43.48,95.56,78.05
09406100,"VIRGIN RIVER AB LA VERKIN CREEK NR LA VE",37.1969,-113.285,15010008,33.27,2019-02-28,cfs,7,0,12.61,57.46,51.18
09408000,"LEEDS CREEK NEAR LEEDS, UT",37.2675,-113.371,15010008,3.77,2019-02-28,cfs,7,5,32.16,81.78,59.84
09408135,"VIRGIN RIVER AB QUAIL CREEK NEAR HURRICA",37.1925,-113.353,15010008,77.56,2019-02-28,cfs,7,0,40.19,92.12,37.43
09408150,"VIRGIN RIVER NEAR HURRICANE, UT",37.1628,-113.395,15010008,79.85,2019-02-28,cfs,6,4,15.15,46.6,35.14
09408195,"FORT PEARCE WASH NEAR ST. GEORGE, UT",37.0016,-113.469,15010009,0,2019-02-28,cfs,7,0,,,
09408400,"SANTA CLARA RIVER NEAR PINE VALLEY, UT",37.3833,-113.483,15010008,4.63,2019-02-28,cfs,7,5,72.5,153.31,120.89
09409100,"SANTA CLARA RIVER ABV BAKER RES, NR CENT",37.3847,-113.632,15010008,10.63,2019-02-28,cfs,7,0,90.01,805.3,289.65
09410100,"SANTA CLARA RIV BLW WINSOR DAM, NR SANTA",37.19,-113.768,15010008,2.27,2019-02-28,cfs,7,4,24.54,41.65,6.33
09413000,"SANTA CLARA RIVER AT ST. GEORGE, UT",37.0753,-113.593,15010008,11.92,2019-02-28,cfs,7,5,61.99,139.25,42.88
09413200,"VIRGIN RIVER NEAR BLOOMINGTON, UT",37.07,-113.584,15010008,102.41,2019-02-28,cfs,7,4,22.08,51.68,40.22
09413500,"VIRGIN RIVER NEAR ST. GEORGE, UT",37.0144,-113.681,15010010,127.09,2019-02-28,cfs,7,5,32.35,82.6,56.89
09413700,"VIRGIN RV ABV THE NARROWS NR LITTLEFIELD",36.9214,-113.831,15010010,128.93,2019-02-28,cfs,7,0,47.4,92.74,69.7
09413900,"BEAVER DAM WASH NEAR ENTERPRISE, UT",37.47,-114.047,15010010,7.18,2019-02-28,cfs,7,0,50.94,106.37,23.19
09415000,"VIRGIN RV AT LITTLEFIELD, AZ",36.8916,-113.924,15010010,190.14,2019-02-28,cfs,7,5,38.1,85.98,59.51
09415060,"MESQUITE CANAL NR MESQUITE, NV",36.8099,-114.015,15010010,1.89,2019-02-28,cfs,7,0,24.7,23.8,18.44
09415250,"VIRGIN RV ABV LAKE MEAD NR OVERTON, NV",36.5132,-114.336,15010010,,,,,0,,,
09415510,"PRESTON BIG SPRG NR PRESTON, NV",38.9333,-115.08,15010011,9.14,2019-02-28,cfs,7,0,93.41,116.28,114.54
09415558,"HOT CK NR SUNNYSIDE, NV",38.3794,-115.152,15010011,12.64,2019-02-28,cfs,7,0,8.33,89.71,90.16
09415589,"CRYSTAL SPGS DIV NR HIKO, NV",37.5318,-115.234,15010011,0,2019-02-28,cfs,7,0,,,
09415590,"209 S05 E60 10 1 CRYSTAL SPGS NR HIKO, N",37.5319,-115.233,15010011,12.63,2019-02-28,cfs,7,0,57.96,101.45,110.98
09415645,"ASH SPGS CK BLW DIV AT HWY 93 AT ASH SPG",37.46,-115.195,15010011,18.83,2019-02-28,cfs,7,0,79.45,107.11,109.99
09415900,"MUDDY SPGS AT LDS FARM NR MOAPA, NV",36.7216,-114.716,15010012,6.86,2019-02-28,cfs,7,3,8.46,89.79,88.63
09415908,"PEDERSON E SPGS NR MOAPA, NV",36.7094,-114.716,15010012,0.14,2019-02-28,cfs,7,0,22.5,66.67,73.68
09415910,"PEDERSON SPGS NR MOAPA, NV",36.7096,-114.716,15010012,0.12,2019-02-28,cfs,7,0,8,54.55,57.14
09415920,"WARM SPGS W NR MOAPA, NV",36.7112,-114.714,15010012,3.29,2019-02-28,cfs,7,1,3.23,89.16,89.4
09415927,"WARM SPGS CONFL AT IVERSON FLUME NR MOAP",36.7113,-114.71,15010012,4.51,2019-02-28,cfs,7,0,21.25,94.15,71.14
09416000,"MUDDY RV NR MOAPA, NV",36.7111,-114.695,15010012,45.29,2019-02-28,cfs,7,5,61.51,104.91,104.19
09417500,"MEADOW VALLEY WASH AT EAGLE CYN NR URSIN",38.0041,-114.207,15010013,28.04,2019-02-28,cfs,7,0,95.65,254.68,228.71
09418500,"MEADOW VALLEY WASH NR CALIENTE, NV",37.5584,-114.563,15010013,3.61,2019-02-28,cfs,7,4,10.97,34.48,17.58
09419000,"MUDDY RV NR GLENDALE, NV",36.643,-114.54,15010012,40.41,2019-02-28,cfs,7,5,29.9,91.84,77.25
09419550,"ROGERS SPNG NR OVERTON BEACH, NV",36.3766,-114.444,15010005,1.39,2019-02-28,cfs,7,3,8.93,84.24,85.8
09419625,"CORN CK SPGS AT NATIONAL FISH & WILDLIFE",36.4388,-115.358,15010015,0.38,2019-02-28,cfs,7,7,96.77,118.75,118.75
09419659,"SLOAN CHANNEL TRIB AT LAS VEGAS BLVD NR ",36.2286,-115.074,15010015,0,2019-02-28,cfs,7,0,,,
09419665,"SLOAN CHANNEL AT CHARLESTON BLVD NR LAS ",36.1597,-115.045,15010015,1.51,2019-02-28,cfs,7,0,65.34,755,26.4
09419679,"LAS VEGAS WASTEWAY NR E LAS VEGAS, NV",36.1061,-115.019,15010015,271.57,2019-02-28,cfs,7,6,79.71,131.1,128.43
09419696,"DUCK CK AT BROADBENT BLVD AT E LAS VEGAS",36.0908,-115.024,15010015,11.13,2019-02-28,cfs,7,0,55.61,122.98,65.94
09419698,"LV WASH BLW DUCK CK CONF NR HENDERSON, N",36.0915,-115,15010015,249,2019-02-28,cfs,7,0,0,0,0
09419700,"LAS VEGAS WASH AT PABCO RD NR HENDERSON,",36.0875,-114.986,15010015,332.57,2019-02-28,cfs,7,6,84.94,448.57,208.25
09419740,"C-1 CHANNEL NR WARM SPGS RD AT HENDERSON",36.0447,-114.959,15010015,0.01,2019-02-28,cfs,7,0,51.67,0,2.63
09419745,"C-1 CHANNEL ABV MOUTH NR HENDERSON, NV",36.085,-114.968,15010015,0,2019-02-28,cfs,7,0,,,
09419747,"LV WASH ABV BOSTICK WEIR NR HENDERSON, N",36.0898,-114.972,15010015,324.43,2019-02-28,cfs,7,0,0,0,0
09419749,"LV WASH ABV HOMESTEAD WEIR NR HENDERSON,",36.0942,-114.955,15010015,348.71,2019-02-28,cfs,7,0,0,0,0
09419753,"LV WASH ABV THREE KIDS WASH BLW HENDERSO",36.1004,-114.943,15010015,323.43,2019-02-28,cfs,7,0,75.24,113.88,116.58
09419756,"LAS VEGAS WASH OVERFLOW AT LAKE LAS VEGA",36.1025,-114.934,15010015,0,2019-02-28,cfs,7,0,,,
09419800,"LV WASH BLW LAKE LAS VEGAS NR BOULDER CI",36.1222,-114.905,15010015,334.43,2019-02-28,cfs,7,6,82.87,125.73,152.26
09423000,"COLORADO RIVER BELOW DAVIS DAM, AZ-NV",35.1917,-114.572,15030101,7967.14,2019-02-28,cfs,7,4,10.28,66,62.64
09423350,"CARUTHERS C NR IVANPAH CA",35.245,-115.299,15030102,0.1,2019-02-28,cfs,7,5,73.33,0,50
09423550,"TOPOCK MARSH INLET NEAR NEEDLES, CA",34.8361,-114.585,15030101,-0.16,2019-02-28,cfs,7,0,1.89,-1.48,-0.51
09423560,"FIREBREAK CANAL AT HAVASU NWR NEAR NEEDL",34.8079,-114.571,15030101,0.8,2019-02-28,cfs,7,0,16.06,9,4.49
09424150,"COLORADO RIVER AQUEDUCT NEAR PARKER DAM,",34.3161,-114.157,15030101,,,,,0,,,
09424447,"BURRO CREEK AT OLD US 93 BRIDGE, NEAR BA",34.5417,-113.445,15030202,509.71,2019-02-28,cfs,7,0,84.06,3085.41,277.62
09424450,"BIG SANDY RIVER NEAR WIKIEUP, AZ",34.4625,-113.624,15030201,323.14,2019-02-28,cfs,7,6,80.46,1961.99,124.86
09424580,"UPPER LITTLE SYCAMORE WASH NEAR BAGDAD, ",34.5707,-113.068,15030203,39.24,2019-02-28,cfs,7,0,55.74,134.48,134.48
09424600,"LITTLE SYCAMORE WASH NEAR BAGDAD, AZ",34.5492,-113.058,15030203,33.09,2019-02-28,cfs,7,0,54.07,124.45,124.45
09424900,"SANTA MARIA RIVER NEAR BAGDAD, AZ",34.3059,-113.347,15030203,261.56,2019-02-28,cfs,7,6,81.85,1719.66,186.63
09426000,"BILL WILLIAMS RIVER BELOW ALAMO DAM, AZ",34.2309,-113.609,15030204,,,,,0,,,
09426620,"BILL WILLIAMS RIVER NEAR PARKER, AZ",34.2625,-114.028,15030204,,,,,0,,,
09426650,"CENTRAL ARIZONA PROJECT CANAL AT HAVASU ",34.2889,-114.111,15030204,,,,,0,,,
09427520,"COLORADO RIVER BELOW PARKER DAM, AZ-CA",34.2956,-114.14,15030101,7742.86,2019-02-28,cfs,7,4,21.13,80.48,69.01
09428500,"CRIR MAIN CANAL NEAR PARKER, AZ",34.1678,-114.277,15030104,498.71,2019-02-28,cfs,7,4,24.74,71.92,76.01
09428505,"GARDNER LATERAL SPILL NEAR PARKER, AZ",34.0278,-114.434,15030104,7.56,2019-02-28,cfs,7,6,76.31,176.22,143.73
09428510,"POSTON WASTEWAY NEAR POSTON, AZ",33.9995,-114.446,15030104,119.01,2019-02-28,cfs,7,5,61.29,111.53,107.15
09429000,"PALO VERDE CANAL NEAR BLYTHE, CA",33.732,-114.512,15030104,898.14,2019-02-28,cfs,7,4,24.97,81.96,85.54
09429030,"PALO VERDE DRAIN NEAR PARKER, AZ",33.757,-114.497,15030104,15.13,2019-02-28,cfs,7,5,40.86,90.06,69.24
09429070,"CRIR LWR MAIN DRAIN BLW TYSON WW, NR EHR",33.7316,-114.504,15030104,,,,,0,,,
09429100,"COLORADO RIVER BELOW PALO VERDE DAM, AZ-",33.7195,-114.498,15030104,6037.14,2019-02-28,cfs,7,4,15.95,79.95,79.53
09429130,"P.V.I.D. OLIVE LAKE DRAIN NEAR BLYTHE, C",33.6839,-114.538,15030104,,,,,0,,,
09429155,"PVID F-CANAL SPILL NEAR BLYTHE, CA",33.5747,-114.546,15030104,12.12,2019-02-28,cfs,7,5,25.82,59.41,59.35
09429160,"PVID D-10-11-2 SPILL NR BLYTHE, CA",33.535,-114.561,15030104,,,,,0,,,
09429170,"PVID D-10-11-5 SPILL NR BLYTHE, CA",33.5092,-114.577,15030104,,,,,0,,,
09429180,"PVID D23 SPILL NEAR BLYTHE, CA",33.4917,-114.604,15030104,18.67,2019-02-28,cfs,7,4,16.21,84.17,81.6
09429190,"P.V.I.D. D-23-1 NEAR BLYTHE, CA",33.4339,-114.629,15030104,,,,,0,,,
09429200,"PVID C CANAL SPILL NEAR BLYTHE, CA",33.4278,-114.673,15030104,33.03,2019-02-28,cfs,7,4,13.31,78.61,73.24
09429210,"P.V.I.D. C-28 UPPER SPILL NEAR BLYTHE, C",33.397,-114.724,15030104,,,,,0,,,
09429220,"PALO VERDE OUTFALL DRAIN NEAR PALO VERDE",33.3614,-114.723,15030104,,,,,0,,,
09429230,"PVID C28 LOWER SPILL NEAR BLYTHE, CA.",33.3511,-114.714,15030104,,,,,0,,,
09429490,"COLORADO RIVER ABOVE IMPERIAL DAM, AZ-CA",32.8849,-114.468,15030104,6411.43,2019-02-28,cfs,7,4,13.36,80.95,68.84
09429500,"COLORADO RIVER BELOW IMPERIAL DAM, AZ-CA",32.8676,-114.472,15030107,353.86,2019-02-28,cfs,7,5,58.17,107.93,31.48
09429600,"COLORADO RIVER BELOW LAGUNA DAM, AZ-CA",32.8123,-114.515,15030107,454.43,2019-02-28,cfs,7,5,64.6,114.1,31.83
09430010,"WEST FORK GILA RIVER AT GILA CLIFF DWELL",33.2292,-108.265,15040001,60.84,2019-02-28,cfs,7,0,0,0,0
09430020,"W FORK GILA R BLW MDL FORK NR GILA HOT S",33.2219,-108.242,15040001,107.84,2019-02-28,cfs,7,0,0,0,0
09430030,"Gila River nr Gila Hot Springs, NM",33.1797,-108.206,15040001,147.14,2019-02-28,cfs,7,0,0,0,0
09430500,"GILA RIVER NEAR GILA, NM",33.0615,-108.537,15040001,228.14,2019-02-28,cfs,7,5,70.52,208.75,92.44
09430600,"MOGOLLON CREEK NEAR CLIFF, NM",33.1667,-108.65,15040001,31.3,2019-02-28,cfs,7,5,56.19,161.42,58.54
09431500,"GILA RIVER NEAR REDROCK, NM",32.7269,-108.676,15040002,266.86,2019-02-28,cfs,7,5,57.13,128.12,63.27
09432000,"GILA RIVER BELOW BLUE CREEK, NEAR VIRDEN",32.6482,-108.846,15040002,267.43,2019-02-28,cfs,7,5,61.92,180.53,68.14
09439000,"GILA RIVER AT DUNCAN, AZ",32.7244,-109.099,15040002,231.14,2019-02-28,cfs,7,0,58.56,142.18,49.99
09442000,"GILA RIVER NEAR CLIFTON, AZ",32.9653,-109.309,15040002,285,2019-02-28,cfs,7,5,66.98,250.64,85.05
09444000,"SAN FRANCISCO RIVER NEAR GLENWOOD, NM",33.2472,-108.88,15040004,53.5,2019-02-28,cfs,7,5,58.73,123.93,39.77
09444200,"BLUE RIVER NEAR CLIFTON, AZ.",33.2909,-109.196,15040004,115.87,2019-02-28,cfs,7,5,72.24,309.56,84.44
09444500,"SAN FRANCISCO RIVER AT CLIFTON, AZ.",33.0495,-109.296,15040004,299.29,2019-02-28,cfs,7,5,70.7,241.09,79.36
09446320,"EAGLE CREEK AT EAGLE SCHOOL RD, NEAR MOR",33.3591,-109.492,15040005,19.6,2019-02-28,cfs,7,0,0,0,0
09447000,"EAGLE CREEK ABOVE PUMPING PLANT, NEAR MO",33.0645,-109.442,15040005,89.76,2019-02-28,cfs,7,6,75.61,286.86,77.4
09447800,"BONITA CREEK NEAR MORENCI, AZ.",32.9556,-109.531,15040005,2.82,2019-02-28,cfs,7,4,23.82,63.23,26.93
09448500,"GILA RIVER AT HEAD OF SAFFORD VALLEY, NR",32.8684,-109.511,15040005,495.57,2019-02-28,cfs,7,5,65.33,199.94,61.7
09466500,"GILA RIVER AT CALVA, AZ.",33.1856,-110.22,15040005,531.57,2019-02-28,cfs,7,5,68.4,287.57,63.84
09468500,"SAN CARLOS RIVER NEAR PERIDOT, AZ.",33.2964,-110.451,15040007,416.57,2019-02-28,cfs,7,7,91.33,1647.17,397.83
09469500,"GILA RIVER BELOW COOLIDGE DAM, AZ.",33.1695,-110.531,15050100,2.69,2019-02-28,cfs,7,3,5.48,1.55,0.61
09470500,"SAN PEDRO RIVER AT PALOMINAS, AZ.",31.3801,-110.111,15050202,0.05,2019-02-28,cfs,7,2,3.65,2.2,0.72
09470700,"BANNING CREEK NEAR BISBEE, AZ",31.5035,-110.005,15050202,0.15,2019-02-28,cfs,7,0,72.33,0,88.24
09470750,"RAMSEY CANYON NEAR SIERRA VISTA, AZ",31.4467,-110.306,15050202,0.37,2019-02-28,cfs,6,0,58.33,160.87,80.43
09470800,"GARDEN CANYON NEAR FORT HUACHUCA, AZ",31.4729,-110.348,15050202,1.04,2019-02-28,cfs,7,5,64.79,281.08,72.73
09471000,"SAN PEDRO RIVER AT CHARLESTON, AZ.",31.6259,-110.175,15050202,10.24,2019-02-28,cfs,7,4,11.73,69.95,45.9
09471310,"HUACHUCA CANYON NEAR FORT HUACHUCA, AZ",31.5181,-110.387,15050202,0.49,2019-02-28,cfs,7,0,90.27,490,326.67
09471380,"UPPER BABOCOMARI RIVER NEAR HUACHUCA CIT",31.635,-110.425,15050202,0.16,2019-02-28,cfs,7,0,5.56,12.12,6.23
09471400,"BABOCOMARI RIVER NEAR TOMBSTONE, AZ.",31.7003,-110.226,15050202,0.91,2019-02-28,cfs,7,0,30,93.81,78.45
09471550,"SAN PEDRO RIVER NEAR TOMBSTONE, AZ",31.7509,-110.201,15050202,12.2,2019-02-28,cfs,7,5,46.02,95.99,51.89
09471580,"SAN PEDRO RIVER AT ST DAVID, AZ",31.9053,-110.246,15050202,,,,,0,,,
09472050,"SAN PEDRO R AT REDINGTON BRIDGE NR REDIN",32.4462,-110.488,15050203,189.96,2019-02-28,cfs,7,0,0,0,0
09473000,"ARAVAIPA CREEK NEAR MAMMOTH, AZ.",32.8442,-110.63,15050203,215.57,2019-02-28,cfs,7,7,93.97,996.16,444.47
09474000,"GILA RIVER AT KELVIN, AZ.",33.1028,-110.977,15050100,572.71,2019-02-28,cfs,7,6,81.69,232.67,99.98
09479350,"GILA RIVER NEAR MARICOPA, AZ.",33.1687,-112.007,15050100,0.48,2019-02-28,cfs,7,0,92.79,0,960
09480500,"SANTA CRUZ RIVER NEAR NOGALES, AZ.",31.3445,-110.851,15050301,0.39,2019-02-28,cfs,7,4,20.53,8.3,1.91
09481000,"NOGALES WASH AT NOGALES, AZ",31.3433,-110.932,15050301,35.69,2019-02-28,cfs,7,0,90,1071.77,1326.77
09481740,"SANTA CRUZ RIVER AT TUBAC, AZ.",31.6129,-111.041,15050301,118.01,2019-02-28,cfs,7,0,95.83,599.34,552.74
09482000,"SANTA CRUZ RIVER AT CONTINENTAL, AZ",31.8715,-110.98,15050301,11.74,2019-02-28,cfs,7,7,95.06,0,274.3
09482500,"SANTA CRUZ RIVER AT TUCSON, AZ",32.2212,-110.982,15050301,16.5,2019-02-28,cfs,7,0,92.52,0,948.28
09484000,"SABINO CREEK NEAR TUCSON, AZ",32.3147,-110.811,15050302,121.7,2019-02-28,cfs,7,7,94.56,803.3,430.49
