site_no,station_nm,dec_lat_va,dec_long_va,huc_cd,flow,flow_dt,flow_unit,flow_nday,class,percentile,percent_median,percent_mean
02335700,"BIG CREEK NEAR ALPHARETTA, GA",34.0506,-84.2694,03130001,554,2019-02-28,cfs,7,7,93.42,387.82,263.38
02335757,"BIG CREEK BELOW HOG WALLOW CREEK AT ROSW",34.0175,-84.3533,03130001,802.86,2019-02-28,cfs,7,0,92.2,411.72,262.83
02335790,"WILLEO CREEK AT GA 120, NEAR ROSWELL, GA",34.0029,-84.3944,03130001,76.56,2019-02-28,cfs,7,0,90.38,270.82,249.79
02335815,"CHATTAHOOCHEE RIVER BELOW MORGAN FALLS D",33.9681,-84.3828,03130001,7021.43,2019-02-28,cfs,7,0,94.44,426.65,287.93
02335870,"SOPE CREEK NEAR MARIETTA, GA",33.9539,-84.4433,03130001,100.1,2019-02-28,cfs,7,5,72.26,143.06,115.99
02335910,"ROTTENWOOD CR AT INTERSTATE N PKWY, NR S",33.8937,-84.4577,03130001,50.86,2019-02-28,cfs,7,0,56.19,109.45,87.74
02336000,"CHATTAHOOCHEE RIVER AT ATLANTA, GA",33.8592,-84.4544,03130001,7450,2019-02-28,cfs,7,7,96.05,321.91,258.27
02336030,"N.F. PEACHTREE CREEK AT GRAVES RD, NR DO",33.9057,-84.2249,03130001,4.06,2019-02-28,cfs,7,0,55.32,131.82,101
02336120,"N.F. PEACHTREE CREEK, BUFORD HWY, NEAR A",33.8315,-84.3427,03130001,69.34,2019-02-28,cfs,7,0,48.71,93.66,67.16
02336152,"SOUTH FORK PEACHTREE AT CASA DR, NR CLAR",33.8104,-84.248,03130001,9.61,2019-02-28,cfs,7,0,59.4,124,76.51
02336240,"S.F. PEACHTREE CREEK JOHNSON RD, NEAR AT",33.8029,-84.3408,03130001,52.89,2019-02-28,cfs,7,0,51.35,107.92,67.89
02336300,"PEACHTREE CREEK AT ATLANTA, GA",33.8203,-84.4076,03130001,160.27,2019-02-28,cfs,7,5,58.64,122.21,81.24
02336313,"WOODALL CREEK AT DEFOORS FERRY RD, AT AT",33.8218,-84.4388,03130001,9.51,2019-02-28,cfs,6,0,70.54,146.31,115.13
02336340,"NANCY CREEK AT JOHNSON FERRY RD, AT CHAM",33.8979,-84.3455,03130001,34.97,2019-02-28,cfs,7,0,47.33,90.6,67.92
02336360,"NANCY CREEK AT RICKENBACKER DRIVE, AT AT",33.8692,-84.3789,03130001,57.06,2019-02-28,cfs,7,0,52.8,107.6,82.03
02336410,"NANCY CREEK AT WEST WESLEY ROAD, AT ATLA",33.8384,-84.4394,03130001,88.8,2019-02-28,cfs,7,0,50.74,101.96,79.5
02336490,"CHATTAHOOCHEE RIVER AT GA 280, NEAR ATLA",33.8169,-84.48,03130002,7918.57,2019-02-28,cfs,7,7,95.17,286.76,230.15
02336517,"PROCTOR CREEK AT HORTENSE WAY, AT ATLANT",33.7757,-84.4408,03130002,,,,,0,,,
02336526,"PROCTOR CREEK AT JACKSON PARKWAY, AT ATL",33.7943,-84.4744,03130002,27.34,2019-02-28,cfs,7,0,52.19,120.92,86.88
02336635,"NICKAJACK CREEK AT US 78/278, NEAR MABLE",33.8033,-84.5214,03130002,83.46,2019-02-28,cfs,7,0,63.18,131.23,116.53
02336728,"UTOY CREEK AT GREAT SOUTHWEST PKWY NR AT",33.7434,-84.5683,03130002,50.1,2019-02-28,cfs,7,0,46.44,84.3,74.43
02336840,"SWEETWATER CREEK,BROWNSVILLE RD,POWDER S",33.8273,-84.7197,03130002,634.29,2019-02-28,cfs,7,0,90.91,337.39,246.89
02336870,"POWDER SPRINGS CREEK NEAR POWDER SPRINGS",33.8593,-84.688,03130002,86.84,2019-02-28,cfs,7,0,74.36,172.16,141.09
02336910,"SWEETWATER CR 0.05 MI US RR BRIDGE AT AU",33.8178,-84.65,03130002,959.14,2019-02-28,cfs,7,0,87.5,442,260.87
02336968,"NOSES CREEK AT POWDER SPRINGS RD,POWDER ",33.8593,-84.6527,03130002,217.09,2019-02-28,cfs,7,0,82.84,263.2,203.27
02336986,"OLLEY CREEK AT CLAY ROAD, NEAR AUSTELL, ",33.8362,-84.6316,03130002,41.32,2019-02-28,cfs,5,0,71.3,149.98,122.79
02337000,"SWEETWATER CREEK NEAR AUSTELL, GA",33.7766,-84.6155,03130002,1720.43,2019-02-28,cfs,7,7,95.25,418.96,285.15
02337040,"SWEETWATER CREEK BELOW AUSTELL, GA",33.7209,-84.6149,03130002,,,,,0,,,
02337170,"CHATTAHOOCHEE RIVER NEAR FAIRBURN, GA",33.6567,-84.6736,03130002,10507.1,2019-02-28,cfs,7,8,98.11,266.1,246.91
02337410,"DOG RIVER AT GA 5, NEAR FAIRPLAY, GA",33.6538,-84.821,03130002,287.86,2019-02-28,cfs,7,0,78.48,263.9,183.96
02337498,"SNAKE CRK DS SNAKE CRK RESERVIOR NR WHIT",33.5272,-84.9364,03130002,139.11,2019-02-28,cfs,7,0,87.27,452.68,292.8
02337500,"SNAKE CREEK NEAR WHITESBURG, GA",33.5296,-84.9283,03130002,148.2,2019-02-28,cfs,7,7,90.66,232.84,186.23
02338000,"CHATTAHOOCHEE RIVER NEAR WHITESBURG, GA",33.4771,-84.9008,03130002,11347.1,2019-02-28,cfs,7,0,91.67,256.39,239.53
02338500,"CHATTAHOOCHEE RIVER AT GA 100, AT FRANKL",33.2793,-85.0999,03130002,12808.6,2019-02-28,cfs,7,0,86.25,241.09,202.16
02338523,"HILLABAHATCHEE CREEK AT THAXTON RD, NR F",33.3407,-85.2269,03130002,60.01,2019-02-28,cfs,7,0,81.83,187.12,159.47
02338660,"NEW RIVER AT GA 100, NEAR CORINTH, GA",33.2354,-84.9877,03130002,482,2019-02-28,cfs,7,6,83.42,228.75,163.73
02338840,"YELLOWJACKET CREEK-HAMMETT RD, BLW HOGAN",33.1396,-84.9752,03130002,174.14,2019-02-28,cfs,7,0,46.15,87.95,59.23
02339495,"OSELIGEE CREEK NEAR LANETT AL",32.9015,-85.1963,03130002,245.14,2019-02-28,cfs,7,0,62.38,120.5,74.27
02339500,"CHATTAHOOCHEE RIVER AT WEST POINT, GA",32.8862,-85.1822,03130002,17216.7,2019-02-28,cfs,6,7,96.22,256.24,241.99
02341460,"CHATTAHOOCHEE RIVER AT 14TH ST, AT COLUM",32.4728,-84.9967,03130003,18771.4,2019-02-28,cfs,7,7,91.18,216.49,181.03
02341800,"UPATOI CREEK NEAR COLUMBUS, GA",32.4135,-84.8199,03130003,455.86,2019-02-28,cfs,7,5,26.86,70.98,58.72
02342500,"UCHEE CREEK NEAR FORT MITCHELL, AL.",32.3168,-85.0149,03130003,355.29,2019-02-28,cfs,7,4,14.08,52.79,39.07
02342850,"HANNAHATCHEE CREEK AT UNION ROAD, AT UNI",32.1529,-84.9058,03130003,90.26,2019-02-28,cfs,7,0,31.99,68.16,53.4
02342881,"CHATTAHOOCHEE RIVER AT SPUR 39, NEAR OMA",32.1424,-85.0463,03130003,20742.9,2019-02-28,cfs,7,0,80.05,164.14,160.92
02343225,"PATAULA CREEK NEAR GEORGETOWN, GA",31.8185,-84.9738,03130003,430.71,2019-02-28,cfs,7,0,36.44,76.33,70.72
02343801,"CHATTAHOOCHEE RIVER NEAR COLUMBIA, AL",31.2593,-85.1102,03130004,23128.6,2019-02-28,cfs,7,6,82,151.15,140.21
02343805,"CHATTAHOOCHEE RIVER AT MILE 46 NEAR COLU",31.2491,-85.1066,03130004,21942.9,2019-02-28,cfs,7,0,70.08,128.47,112.86
02343940,"SAWHATCHEE CREEK AT CEDAR SPRINGS, GA",31.1808,-85.0436,03130004,62.07,2019-02-28,cfs,7,0,22.11,47.43,24.76
02344280,"CAMP CREEK AT HELMER ROAD, NEAR FAYETTEV",33.5258,-84.4339,03130005,29.43,2019-02-28,cfs,7,0,45.54,87.36,57.12
02344327,"MORNING CRK AT WESTBRIDGE RD, NR FAYETTE",33.5414,-84.4842,03130005,54.85,2019-02-28,cfs,6,0,41.96,81.27,41.69
02344350,"FLINT RIVER NEAR LOVEJOY, GA",33.4156,-84.3847,03130005,449.43,2019-02-28,cfs,7,6,80.7,180.24,143.41
02344396,"FLINT RIVER AT WOOLSEY ROAD, NEAR WOOLSE",33.3597,-84.3944,03130005,536.71,2019-02-28,cfs,7,0,71.74,167.42,122.77
02344424,"LAKE HORTON (TAILRACE) NEAR FAYETTEVILLE",33.3186,-84.4186,03130005,3.84,2019-02-28,cfs,7,0,0,0,0
02344478,"SHOAL CREEK AT SHOAL CREEK ROAD, NEAR GR",33.2569,-84.3628,03130005,33,2019-02-28,cfs,7,0,71.1,151.17,117.65
02344500,"FLINT RIVER NEAR GRIFFIN, GA",33.2442,-84.4292,03130005,882.86,2019-02-28,cfs,7,6,82.62,193.76,139.51
02344605,"LINE CREEK BELOW GA 54, NEAR PEACHTREE C",33.3956,-84.6069,03130005,113.57,2019-02-28,cfs,7,0,69.19,169.81,98.56
02344620,"SHOAL CREEK AT GA54, NEAR SHARPSBURG, GA",33.3892,-84.6247,03130005,60.8,2019-02-28,cfs,7,0,70.13,136.35,88.09
02344630,"LINE CREEK BLW LAKE MCINTOSH, NR PEACHTR",33.3576,-84.5824,03130005,197.29,2019-02-28,cfs,7,0,56.25,247.45,84.62
02344655,"FLAT CR DS OF LAKE KEDRON, NR PEACHTREE ",33.4217,-84.5783,03130005,39.8,2019-02-28,cfs,7,0,43.3,82.47,73.38
02344673,"FLAT CREEK (DS OF LAKE) AT PEACHTREE CIT",33.3832,-84.5727,03130005,56.14,2019-02-28,cfs,7,0,42.71,79.22,84.71
02344700,"LINE CREEK NEAR SENOIA, GA",33.3192,-84.5222,03130005,389.14,2019-02-28,cfs,7,7,90.19,224.65,167.62
02344724,"WHITEWATER CREEK AT EASTIN RD, NR FAYETT",33.4872,-84.5083,03130005,48.67,2019-02-28,cfs,7,0,52.49,125.47,74.89
02344736,"WHITEWATER CR AT SHERWOOD RD, NR FAYETTE",33.4214,-84.4928,03130005,131.46,2019-02-28,cfs,7,0,52.43,118.85,81.51
02344748,"WHITEWATER CR (DS STARRS MILL DAM) FAYET",33.3283,-84.5092,03130005,260.57,2019-02-28,cfs,7,0,53.38,119.79,93.61
02344872,"FLINT RIVER BELOW BIG BRANCH, NEAR MOLEN",33.0471,-84.5269,03130005,2308.57,2019-02-28,cfs,7,0,71.85,172.85,123.81
02346180,"FLINT RIVER NEAR THOMASTON, GA",32.839,-84.4241,03130005,3514.29,2019-02-28,cfs,7,0,78.08,164.44,127.8
02346310,"POTATO CREEK AT COUNTY LINE RD, NR ORCHA",33.1872,-84.2294,03130005,12.45,2019-02-28,cfs,7,0,35.54,74.11,50.28
02347500,"FLINT RIVER AT US 19, NEAR CARSONVILLE, ",32.7214,-84.2325,03130005,4135.71,2019-02-28,cfs,7,5,69.4,133.59,95.45
02349605,"FLINT RIVER AT GA 26, NEAR MONTEZUMA, GA",32.2931,-84.0436,03130006,5287.14,2019-02-28,cfs,7,5,54.96,108.66,86.39
02349900,"TURKEY CREEK AT BYROMVILLE, GA",32.1956,-83.9022,03130006,39.9,2019-02-28,cfs,7,5,29.29,55.73,40.46
02350512,"FLINT RIVER AT GA 32, NEAR OAKFIELD, GA",31.725,-84.0186,03130006,5827.14,2019-02-28,cfs,7,5,46.94,92.5,80.06
02350600,"KINCHAFOONEE CREEK AT PRESTON, GA",32.0525,-84.5483,03130007,254.14,2019-02-28,cfs,7,5,34.3,84.49,74.07
02350900,"KINCHAFOONEE CREEK AT PINEWOOD ROAD, NR ",31.7644,-84.2533,03130007,670.29,2019-02-28,cfs,7,5,40.13,75.08,71.87
02351500,"MUCKALEE CREEK NEAR AMERICUS, GA",32.0831,-84.2581,03130007,237.71,2019-02-28,cfs,7,0,44.91,95.36,87.27
02351890,"MUCKALEE CREEK AT GA 195, NEAR LEESBURG,",31.7761,-84.1394,03130007,465.43,2019-02-28,cfs,7,5,38.09,77.28,69.29
02352500,"FLINT RIVER AT ALBANY, GA",31.5942,-84.1442,03130008,6970,2019-02-28,cfs,7,5,36.06,76,65.72
02353000,"FLINT RIVER AT NEWTON, GA",31.3069,-84.3389,03130008,8440,2019-02-28,cfs,7,5,41.44,84.81,74.39
02353265,"ICHAWAYNOCHAWAY CREEK AT GA 37, NEAR MOR",31.5269,-84.5828,03130009,422.71,2019-02-28,cfs,7,0,48.48,98.6,76.35
02353400,"PACHITLA CREEK NEAR EDISON, GA",31.555,-84.6808,03130009,219.29,2019-02-28,cfs,7,5,26.33,59.75,56.33
02353500,"ICHAWAYNOCHAWAY CREEK AT MILFORD, GA",31.3828,-84.5464,03130009,1030,2019-02-28,cfs,5,5,49.27,99.28,83.41
02354350,"CHICKASAWHATCHEE CREEK NEAR ALBANY, GA",31.5938,-84.4532,03130009,118.17,2019-02-28,cfs,7,0,23.46,78.33,54.09
02354475,"SPRING CREEK NEAR LEARY, GA",31.4656,-84.4494,03130009,22.67,2019-02-28,cfs,7,0,43.27,83.96,83.44
02354500,"CHICKASAWHATCHEE CREEK AT ELMODEL, GA",31.3506,-84.4825,03130009,441.29,2019-02-28,cfs,7,5,48.53,98.72,67.63
02354800,"ICHAWAYNOCHAWAY CREEK NEAR ELMODEL, GA",31.2939,-84.4919,03130009,1516.67,2019-02-28,cfs,6,0,60,104,80.21
02355350,"ICHAWAYNOCHAWAY CREEK BELOW NEWTON, GA",31.2175,-84.4708,03130009,1675.71,2019-02-28,cfs,7,0,71.62,131.65,107.39
02355662,"FLINT RIVER AT RIVERVIEW PLANTATION, NR ",31.1406,-84.4803,03130008,10174.3,2019-02-28,cfs,7,0,52.58,103.46,91.91
02356000,"FLINT RIVER AT BAINBRIDGE, GA",30.9116,-84.5799,03130008,11785.7,2019-02-28,cfs,7,5,50.26,100.63,88.8
02357000,"SPRING CREEK NEAR IRON CITY, GA",31.0403,-84.74,03130010,661.57,2019-02-28,cfs,7,5,41.94,84.88,62.34
02357150,"SPRING CREEK NEAR REYNOLDSVILLE, GA",30.9041,-84.7491,03130010,724.71,2019-02-28,cfs,7,0,40.41,89.09,92.43
02358000,"APALACHICOLA RIVER AT CHATTAHOOCHEE FLA",30.701,-84.8591,03130011,36928.6,2019-02-28,cfs,7,5,61.02,117.98,104.63
02358700,"APALACHICOLA RIVER NR BLOUNTSTOWN,FLORID",30.4252,-85.0313,03130011,35114.3,2019-02-28,cfs,7,5,55.25,108.83,95.07
02358754,"APALACHICOLA R.AB CHIPOLA CUTOFF NR WEWA",30.1323,-85.142,03130011,,,,,0,,,
02358789,"CHIPOLA RIVER AT MARIANNA FL",30.773,-85.2163,03130012,970,2019-02-28,cfs,7,0,46.42,81.46,65.16
02359000,"CHIPOLA RIVER NR ALTHA, FLA.",30.5341,-85.1652,03130012,1905.71,2019-02-28,cfs,7,5,47.03,93.16,85.04
02359170,"APALACHICOLA RIVER NR SUMATRA,FLA.",29.9494,-85.0155,03130011,32150,2019-02-28,cfs,4,5,43.64,92.31,93.4
02359500,"ECONFINA CREEK NEAR BENNETT, FLA.",30.3846,-85.5566,03140101,585.43,2019-02-28,cfs,7,5,63.87,109.76,105.37
02361000,"CHOCTAWHATCHEE RIVER NEAR NEWTON, AL.",31.3429,-85.6105,03140201,944.29,2019-02-28,cfs,7,5,26.04,65.22,60.68
02361500,"CHOCTAWHATCHEE RIVER NEAR BELLWOOD AL",31.1593,-85.7844,03140201,1845.71,2019-02-28,cfs,7,0,41.49,65.95,61.68
02362240,"LITTLE DOUBLE BRIDGES CREEK NR ENTERPRIS",31.2724,-85.9583,03140201,30.33,2019-02-28,cfs,7,5,30.57,66.4,62.56
02363000,"PEA RIVER NEAR ARITON AL",31.5949,-85.783,03140202,488.29,2019-02-28,cfs,7,4,21.15,49.18,44.85
02364500,"PEA RIVER NEAR SAMSON AL",31.1127,-86.0994,03140202,1418.57,2019-02-28,cfs,7,4,18.64,51.71,50.37
02365200,"CHOCTAWHATCHEE RIVER NR PITTMAN, FLA.",30.9499,-85.843,03140203,4130,2019-02-28,cfs,7,0,37.52,68.56,54.06
02365470,"WRIGHTS CREEK AT SH 177-A NR BONIFAY,FL",30.8571,-85.7622,03140203,192.14,2019-02-28,cfs,7,0,40.07,51.28,30.23
02365500,"CHOCTAWHATCHEE RIVER AT CARYVILLE, FLA.",30.7757,-85.8277,03140203,4692.86,2019-02-28,cfs,7,4,22.87,62.76,50.47
02365769,"BRUCE CREEK AT SH 81 NR REDBAY, FL",30.6246,-85.9424,03140203,95.06,2019-02-28,cfs,7,0,34.18,65.89,28.04
02366000,"HOLMES CREEK AT VERNON, FLA.",30.6269,-85.7122,03140203,791,2019-02-28,cfs,7,5,50.72,104.39,66.06
02366500,"CHOCTAWHATCHEE RIVER NR BRUCE, FLA.",30.451,-85.8983,03140203,6471.43,2019-02-28,cfs,7,4,24.7,66.77,57.03
02366996,"ALAQUA CREEK NEAR PLEASANT RIDGE, FL",30.6691,-86.1866,03140102,102.86,2019-02-28,cfs,7,0,54.58,103.8,72.47
02367310,"JUNIPER CREEK AT STATE HWY 85 NR NICEVIL",30.5574,-86.5194,03140102,107.57,2019-02-28,cfs,7,5,70,120.57,110.49
02367900,"YELLOW RIVER NR OAK GROVE, FLA.",30.9252,-86.5594,03140103,742.29,2019-02-28,cfs,7,0,40.66,75.71,53.06
02368000,"YELLOW RIVER AT MILLIGAN, FLA.",30.753,-86.6291,03140103,1010.43,2019-02-28,cfs,7,5,26.22,69.08,60.01
02368500,"SHOAL RIVER NR MOSSY HEAD, FLA.",30.796,-86.3069,03140103,204,2019-02-28,cfs,7,5,31.87,75,57.81
02369000,"SHOAL RIVER NR CRESTVIEW, FLA.",30.6974,-86.5708,03140103,838,2019-02-28,cfs,7,5,28.69,70.85,59.36
02369600,"YELLOW RIVER NR MILTON, FLA.",30.5696,-86.9236,03140103,2281.43,2019-02-28,cfs,7,0,35.13,68.1,77.13
02369800,"BLACKWATER RIVER NEAR BRADLEY AL",31.0277,-86.71,03140104,106.79,2019-02-28,cfs,7,4,24.79,60.68,52.92
02370000,"BLACKWATER RIVER NR BAKER, FLA.",30.8335,-86.7347,03140104,285,2019-02-28,cfs,7,5,30.04,59.09,52.44
02370500,"BIG COLDWATER CREEK NR MILTON, FLA.",30.7085,-86.9722,03140104,436.43,2019-02-28,cfs,7,5,29.21,76.76,67.86
02371500,"CONECUH RIVER AT BRANTLEY AL",31.5735,-86.2516,03140301,607.29,2019-02-28,cfs,7,4,20.33,59.33,49.37
02372250,"PATSALIGA CREEK NEAR BRANTLEY AL",31.5963,-86.4055,03140302,537.57,2019-02-28,cfs,7,5,26.07,60.3,50.29
02372430,"CONECUH RIVER AT RIVER FALLS, ALABAMA",31.3482,-86.5294,03140301,1431.43,2019-02-28,cfs,7,0,17.04,51.52,44.52
02373000,"SEPULGA RIVER NEAR MCKENZIE AL",31.4538,-86.7869,03140303,627.14,2019-02-28,cfs,7,5,27.93,59.54,43.83
02374250,"CONECUH RIVER AT STATE HWY 41 NEAR BREWT",31.0671,-87.0616,03140304,3567.14,2019-02-28,cfs,7,0,41.41,66.78,67.98
02374500,"MURDER CREEK NEAR EVERGREEN AL",31.4185,-86.9866,03140304,314.14,2019-02-28,cfs,7,5,48.71,97.5,72.18
02374700,"MURDER CREEK AT STATE HWY 41 AT BREWTON,",31.101,-87.0689,03140304,620.86,2019-02-28,cfs,7,0,39.48,73.92,59.66
02374745,"BURNT CORN CREEK AT STATE HWY 41 NEAR BR",31.1299,-87.0872,03140304,251.57,2019-02-28,cfs,7,0,35.36,74.59,53.75
02374950,"BIG ESCAMBIA CR AT SARDINE BR NR STANLEY",31.1296,-87.3705,03140305,340.43,2019-02-28,cfs,7,0,52.78,107.2,67.49
02375000,"BIG ESCAMBIA CREEK AT FLOMATON AL",31.0107,-87.2627,03140305,643.14,2019-02-28,cfs,7,0,50.33,100.22,91.07
02375500,"ESCAMBIA RIVER NEAR CENTURY, FL",30.9652,-87.2341,03140305,4420,2019-02-28,cfs,7,4,16.1,49.18,42.1
02376033,"ESCAMBIA RIVER NR MOLINO, FLA.",30.6702,-87.2669,03140305,5687.14,2019-02-28,cfs,7,0,33.6,58.71,54.56
02376100,"BAYOU MARCUS CREEK NR PENSACOLA,FLA",30.4483,-87.2905,03140107,33.46,2019-02-28,cfs,7,0,73.99,125.27,125.18
02376115,"ELEVENMILE CREEK NEAR PENSACOLA, FL.",30.4983,-87.3358,03140107,43.46,2019-02-28,cfs,7,1,3.23,45.13,41.91
02376293,"BRUSHY CREEK NEAR BRATT, FL",30.9785,-87.528,03140106,39.43,2019-02-28,cfs,7,0,53.11,104.48,62.53
02376500,"PERDIDO RIVER AT BARRINEAU PARK, FL",30.6905,-87.4403,03140106,565.43,2019-02-28,cfs,7,5,32.05,80.41,58.8
02377570,"STYX RIVER NEAR ELSANOR, AL.",30.6057,-87.5472,03140106,288.14,2019-02-28,cfs,7,5,27.62,65.85,49.43
02378170,"WOLF CREEK BELOW FOLEY, ALA",30.3883,-87.6528,03140107,12.41,2019-02-28,cfs,7,0,49.46,98.73,77.22
02378300,"MAGNOLIA RIVER AT US 98 NEAR FOLEY, ALAB",30.4066,-87.7369,03160205,31.94,2019-02-28,cfs,7,0,50.55,101.53,62.27
02378500,"FISH RIVER NEAR SILVER HILL AL",30.5455,-87.7986,03160205,97.64,2019-02-28,cfs,7,5,44.76,96.57,74.36
02379500,"CARTECAY RIVER NEAR ELLIJAY, GA",34.6843,-84.4585,03150102,1671,2019-02-28,cfs,7,8,97.96,497.11,408.02
02380500,"COOSAWATTEE RIVER NEAR ELLIJAY, GA",34.6751,-84.5085,03150102,2887.14,2019-02-28,cfs,7,8,98.48,450.91,404.41
02381090,"MOUNTAINTOWN CREEK AT GA 282, NEAR ELLIJ",34.7031,-84.5394,03150102,1047.71,2019-02-28,cfs,7,0,90.91,637.18,530.32
02381600,"FAUSETT CREEK NEAR TALKING ROCK, GA",34.5704,-84.4688,03150102,111.73,2019-02-28,cfs,7,8,97.78,526.78,438.85
02382200,"TALKING ROCK CREEK NEAR HINTON, GA",34.5228,-84.6111,03150102,1120.43,2019-02-28,cfs,7,8,97.83,475.04,401.82
02382500,"COOSAWATTEE RIVER AT CARTERS, GA",34.6037,-84.6955,03150102,3186.43,2019-02-28,cfs,7,7,93.55,277.2,233.85
02383500,"COOSAWATTEE RIVER NEAR PINE CHAPEL, GA",34.5642,-84.8331,03150102,7045.71,2019-02-28,cfs,7,7,97.27,371.39,320.71
02384500,"CONASAUGA RIVER AT GA 286, NEAR ETON, GA",34.8279,-84.8508,03150101,3460,2019-02-28,cfs,7,8,97.37,522.1,400.78
02384540,"MILL CREEK NEAR CRANDALL, GA",34.872,-84.7213,03150101,117.49,2019-02-28,cfs,7,8,97.06,510.83,388.53
02385170,"COAHULLA CREEK AT KEITHS MILL ROAD, NEAR",34.7434,-84.8805,03150101,2480.75,2019-02-28,cfs,4,0,93.33,949.42,537.61
02385500,"MILL CREEK AT DALTON, GA",34.7884,-84.9749,03150101,521.43,2019-02-28,cfs,7,0,96.67,748,541.35
02385800,"HOLLY CREEK NEAR CHATSWORTH, GA",34.7167,-84.77,03150101,876.14,2019-02-28,cfs,7,7,96.08,622.66,374.88
02387000,"CONASAUGA RIVER AT TILTON, GA",34.6667,-84.9283,03150101,12251.4,2019-02-28,cfs,7,8,98.77,818.32,522.63
02387500,"OOSTANAULA RIVER AT RESACA, GA",34.5771,-84.9419,03150103,20114.3,2019-02-28,cfs,7,8,97.73,580.86,424.17
02387600,"OOTHKALOOGA CREEK AT GA 53 SPUR, AT CALH",34.4956,-84.9652,03150103,2535.71,2019-02-28,cfs,7,0,92.86,2568.07,1797.99
02388320,"HEATH CREEK NEAR ARMUCHEE, GA",34.3717,-85.2639,03150103,218.16,2019-02-28,cfs,7,8,97.22,723.82,462.89
02388350,"ARMUCHEE CREEK AT OLD DALTON ROAD, NEAR ",34.3609,-85.1402,03150103,11264.3,2019-02-28,cfs,7,0,0,0,0
02388500,"OOSTANAULA RIVER NEAR ROME, GA",34.2984,-85.138,03150103,31485.7,2019-02-28,cfs,7,8,97.73,680.25,485.59
02388975,"ETOWAH RIVER AT GA 136, NEAR LANDDRUM, G",34.409,-84.0196,03150104,1162,2019-02-28,cfs,7,0,90.91,554.26,419.28
02389150,"ETOWAH RIVER AT GA 9, NEAR DAWSONVILLE, ",34.3581,-84.1133,03150104,1442,2019-02-28,cfs,7,0,93.75,527.37,411.32
02390000,"AMICALOLA CREEK NEAR DAWSONVILLE, GA.",34.4256,-84.2119,03150104,1304.71,2019-02-28,cfs,7,0,96.15,556.55,478.37
02390050,"ETOWAH RIVER AT KELLY BRIDGE ROAD, NEAR ",34.3523,-84.2063,03150104,2617.14,2019-02-28,cfs,7,0,80,324.3,296.41
02390140,"SETTINGDOWN CREEK NEAR BALL GROUND, GA",34.2931,-84.2635,03150104,379.86,2019-02-28,cfs,7,0,92.31,420.62,370.81
02391540,"SHARP MTN CREEK AT OLD GA 5, BELOW BALL ",34.3106,-84.4033,03150104,709.17,2019-02-28,cfs,6,0,92.31,772.01,588.67
02391840,"HICKORY LOG CREEK NEAR CANTON, GA",34.265,-84.4739,03150104,15.59,2019-02-28,cfs,7,0,63.38,151.07,85.28
02391860,"ETOWAH RIVER DOWNSTREAM OF I-575, AT CAN",34.2508,-84.4692,03150104,6761.43,2019-02-28,cfs,7,0,90,569.56,459.96
02392000,"ETOWAH RIVER AT CANTON, GA",34.2399,-84.4947,03150104,6765.71,2019-02-28,cfs,7,7,96.93,436.3,381.66
02392360,"SHOAL CREEK AT GA 108, NEAR WALESKA, GA",34.2634,-84.5955,03150104,480.71,2019-02-28,cfs,7,0,92.31,545.95,424.92
02392780,"LITTLE RIVER AT GA 5, NEAR WOODSTOCK, GA",34.1223,-84.5044,03150104,882.57,2019-02-28,cfs,7,0,92.31,363.72,303.67
02392920,"NOONDAY CR US CHASTAIN MEADOWS PKWY, MAR",34.0219,-84.5529,03150104,155.14,2019-02-28,cfs,7,0,0,0,0
02392950,"NOONDAY CREEK AT HAWKINS STORE RD, NR WO",34.0564,-84.5356,03150104,99.54,2019-02-28,cfs,7,0,72.79,186.89,154.61
02392975,"NOONDAY CREEK AT SHALLOWFORD ROAD, NR WO",34.0683,-84.5356,03150104,178.81,2019-02-28,cfs,7,0,83.85,240.56,203.8
02393377,"BUTLER CREEK AT MACK DOBBS ROAD, NR KENN",34.0169,-84.6433,03150104,12.01,2019-02-28,cfs,7,0,73.28,167.27,130.54
02393419,"ALLATOONA CREEK AT STILESBORO RD, NEAR A",33.9953,-84.6931,03150104,49.19,2019-02-28,cfs,7,0,72.47,213.04,152.29
02394000,"ETOWAH RIVER AT ALLATOONA DAM, ABV CARTE",34.1632,-84.7411,03150104,584.57,2019-02-28,cfs,7,4,12.75,40.77,33.62
02394670,"ETOWAH RIVER AT GA 61, NEAR CARTERSVILLE",34.1429,-84.8388,03150104,2141.43,2019-02-28,cfs,7,0,59.59,166.74,129.45
02394820,"EUHARLEE CREEK AT US 278, AT ROCKMART, G",33.9987,-85.0524,03150104,312.29,2019-02-28,cfs,7,0,87.5,493.9,319.54
02395000,"ETOWAH RIVER NEAR KINGSTON,GA",34.209,-84.9787,03150104,4522.86,2019-02-28,cfs,7,6,76.88,168.14,142.18
02395120,"TWO RUN CREEK NEAR KINGSTON, GA",34.2428,-84.8897,03150104,348.43,2019-02-28,cfs,7,8,97.37,555.62,387.27
02395980,"ETOWAH RIVER AT GA 1 LOOP, NEAR ROME, GA",34.2323,-85.1169,03150104,5970,2019-02-28,cfs,7,0,91.21,225.16,204.18
02397000,"COOSA RIVER (MAYO'S BAR) NEAR ROME, GA",34.2004,-85.2566,03150105,38742.9,2019-02-28,cfs,7,8,98.46,502.08,388.51
02397500,"CEDAR CREEK NEAR CEDARTOWN, GA",34.0615,-85.313,03150105,1182.57,2019-02-28,cfs,7,7,95.24,601.6,397.73
02397530,"COOSA RIVER AT STATE LINE, AL/GA",34.2018,-85.4475,03150105,,,,,0,,,
02398000,"CHATTOOGA RIVER AT SUMMERVILLE, GA",34.4664,-85.3361,03150105,3184.29,2019-02-28,cfs,7,7,98.73,740.77,475.8
02398300,"CHATTOOGA RIVER ABOVE GAYLESVILLE AL",34.2904,-85.5091,03150105,6541.43,2019-02-28,cfs,7,7,97.19,753.38,483.54
02399200,"LITTLE RIVER NEAR BLUE POND AL",34.289,-85.6805,03150105,3172.86,2019-02-28,cfs,7,7,95.14,523.7,301.85
02400100,"TERRAPIN CREEK AT ELLISVILLE AL",34.0651,-85.6141,03150105,2680,2019-02-28,cfs,7,8,97.67,425.88,371.99
02400680,"BIG WILLS CREEK AT STATE HWY 35 NR FORT ",34.4381,-85.7672,03150106,841.29,2019-02-28,cfs,7,0,93.75,821.65,507.14
02401000,"BIG WILLS CREEK NEAR REECE CITY",34.0982,-86.038,03150106,3063.71,2019-02-28,cfs,7,7,97.23,723.31,499.05
02401390,"BIG CANOE CREEK AT ASHVILLE AL",33.8398,-86.2628,03150106,2212.29,2019-02-28,cfs,7,8,98.11,592.88,420.69
02401895,"OHATCHEE CREEK AT OHATCHEE, ALA.",33.7804,-85.9983,03150106,4725.71,2019-02-28,cfs,7,0,75,682.21,337.93
02404400,"CHOCCOLOCCO CREEK AT JACKSON SHOAL NR LI",33.5484,-86.0969,03150106,5551.43,2019-02-28,cfs,7,7,94.1,475.79,310.87
02405500,"KELLY CREEK NEAR VINCENT AL",33.4476,-86.3869,03150106,3772.86,2019-02-28,cfs,7,7,95.57,690.46,415.02
02406500,"TALLADEGA CREEK AT ALPINE AL",33.3596,-86.2341,03150106,1356,2019-02-28,cfs,7,7,96.92,397.07,312.7
02406930,"SHIRTEE CREEK NEAR ODENA, ALABAMA",33.2118,-86.2733,03150107,98.73,2019-02-28,cfs,7,0,75.91,263.35,157.31
02407000,"COOSA RIVER AT CHILDERSBURG AL",33.2918,-86.3639,03150107,58800,2019-02-28,cfs,6,7,94.96,290.17,230.91
02407514,"YELLOWLEAF CREEK NEAR WESTOVER, ALA.",33.3207,-86.4953,03150107,2063,2019-02-28,cfs,7,0,92.31,451.18,370.82
02408150,"WALNUT CREEK ABOVE CLANTON, ALA",32.8903,-86.5792,03150107,152.93,2019-02-28,cfs,7,0,50.68,104.15,82.51
02408540,"HATCHET CREEK BELOW ROCKFORD AL",32.9168,-86.2702,03150107,1340,2019-02-28,cfs,7,6,80.37,183.45,168.79
02411930,"TALLAPOOSA RIVER BELOW TALLAPOOSA, GEORG",33.7409,-85.3363,03150108,1757,2019-02-28,cfs,7,0,94.12,330.53,327.48
02412000,"TALLAPOOSA RIVER NEAR HEFLIN, ALA.",33.6229,-85.5133,03150108,2988.57,2019-02-28,cfs,7,7,95.07,324.84,235.24
02413000,"LITTLE TALLAPOOSA RIVER AT US 27, AT CAR",33.5973,-85.0802,03150108,825.71,2019-02-28,cfs,7,0,96.55,502.87,404.05
02413210,"LITTLE TALLAPOOSA R AT GA 100, NEAR BOWD",33.4929,-85.2791,03150108,2038.57,2019-02-28,cfs,7,0,94.74,505.4,405.3
02413300,"LITTLE TALLAPOOSA RIVER NEAR NEWELL AL",33.4373,-85.3991,03150108,2970,2019-02-28,cfs,7,8,97.67,346.56,289.41
02414500,"TALLAPOOSA RIVER AT WADLEY AL",33.1168,-85.5608,03150109,13640,2019-02-28,cfs,7,8,97.06,315.82,279.04
02414715,"TALLAPOOSA RIVER NR NEW SITE, AL.(HORSES",32.9773,-85.7397,03150109,15252.9,2019-02-28,cfs,7,8,96.97,296.01,264
02415000,"HILLABEE CREEK NEAR HACKNEYVILLE AL",33.0654,-85.878,03150109,1092.14,2019-02-28,cfs,7,6,79.81,225.38,179.3
02418230,"SOUGAHATCHEE CREEK AT CO RD 188 NR LOACH",32.6268,-85.588,03150110,137.2,2019-02-28,cfs,7,0,46.8,90.34,72.21
02418760,"CHEWACLA CREEK AT CHEWACLA STATE PARK NR",32.5482,-85.4805,03150110,53.81,2019-02-28,cfs,7,0,30.34,60.89,42.75
02419000,"UPHAPEE CREEK NEAR TUSKEGEE AL",32.4768,-85.695,03150110,277.57,2019-02-28,cfs,7,4,10.89,38.38,30.12
02419890,"TALLAPOOSA RIVER NEAR MONT.-MONT. WATER ",32.4399,-86.1955,03150110,22942.9,2019-02-28,cfs,7,0,94.66,380.75,274.48
02420000,"ALABAMA RIVER NEAR MONTGOMERY, AL.",32.4115,-86.4083,03150201,110429,2019-02-28,cfs,7,7,95.81,342.04,267.07
02420490,"AUTAUGA CREEK NEAR PRATTVILLE, ALA",32.4667,-86.485,03150201,,,,,0,,,
02421000,"CATOMA CREEK NEAR MONTGOMERY AL",32.3074,-86.2994,03150201,195.14,2019-02-28,cfs,7,5,26.32,36.44,19.77
02422500,"MULBERRY CREEK AT JONES AL",32.5829,-86.9036,03150201,1006.29,2019-02-28,cfs,7,6,87.32,228.93,174.71
02423130,"CAHABA RIVER AT TRUSSVILLE, AL.",33.6223,-86.5994,03150202,203.63,2019-02-28,cfs,7,0,96.29,438.57,311.93
02423160,"CAHABA RIVER NEAR WHITES CHAPEL AL",33.6037,-86.5491,03150202,523.71,2019-02-28,cfs,7,0,81.01,275.93,210.82
02423380,"CAHABA RIVER NEAR MOUNTAIN BROOK AL",33.4818,-86.7128,03150202,1801.71,2019-02-28,cfs,7,8,97.14,443.07,343.83
02423397,"LITTLE CAHABA RIVER BELOW LEEDS, AL.",33.5345,-86.5625,03150202,123.6,2019-02-28,cfs,7,0,81.52,290.76,191.3
02423400,"LITTLE CAHABA RIVER NR JEFFERSON PARK, A",33.4998,-86.6142,03150202,235.37,2019-02-28,cfs,7,0,95.83,313.83,262.13
02423414,"LITTLE CAHABA RIVER AT CAH BEA RD NR CAH",33.4398,-86.6989,03150202,597.43,2019-02-28,cfs,7,0,93.33,506.68,353.47
02423425,"CAHABA RIVER NEAR CAHABA HEIGHTS AL",33.4157,-86.7397,03150202,1748.57,2019-02-28,cfs,7,8,96.88,379.65,294.89
02423496,"CAHABA RIVER NEAR HOOVER, AL",33.3693,-86.7842,03150202,2544,2019-02-28,cfs,7,0,96.67,380.02,319.49
02423500,"CAHABA RIVER NEAR ACTON AL",33.3634,-86.813,03150202,2722.86,2019-02-28,cfs,7,8,98,447.94,353.37
